Title,Release Year,imdb_rating,Genre,show_id,type,title,country,date_added,release_year,rating,duration,listed_in,description,year_added
Safe,2019,9.5,"Action, Crime, Thriller",80201500,TV Show,Safe,United Kingdom,2019-02-05,2018,TV-MA,1 Season,"British TV Shows, Crime TV Shows, International TV Shows","After his teenage daughter goes missing, a widowed surgeon in an affluent neighborhood begins unearthing dark secrets about the people closest to him.",2019.0
Oththa Seruppu Size 7,2019,9.1,Drama,81206389,Movie,Oththa Seruppu Size 7,India,2019-11-04,2019,TV-MA,103 min,"Dramas, International Movies, Thrillers","Taken into custody, a murder suspect's theatrical explanations of his peculiar modus operandi unearth truths far beyond the crime he’s accused of.",2019.0
Innocent,2017,9.0,Comedy,81026192,TV Show,Innocent,Turkey,2019-01-23,2017,TV-MA,1 Season,"Crime TV Shows, International TV Shows, TV Dramas","In a peaceful, rustic town, a retired officer and his family are mired in a murder mystery riddled with shocking, buried secrets.",2019.0
Pulp Fiction,1994,8.9,"Crime, Drama",880640,Movie,Pulp Fiction,United States,2019-01-01,1994,R,154 min,"Classic Movies, Cult Movies, Dramas","This stylized crime caper weaves together stories featuring a burger-loving hit man, his philosophical partner and a washed-up boxer.",2019.0
The Lord of the Rings: The Return of the King,2003,8.9,"Adventure, Drama, Fantasy",60004484,Movie,The Lord of the Rings: The Return of the King,"New Zealand, United States",2020-01-01,2003,PG-13,201 min,"Action & Adventure, Sci-Fi & Fantasy","Aragorn is revealed as the heir to the ancient kings as he, Gandalf and the other members of the broken fellowship struggle to save Gondor.",2020.0
Schindler's List,1993,8.9,"Biography, Drama, History",60036359,Movie,Schindler's List,United States,2018-04-01,1993,R,195 min,"Classic Movies, Dramas","Oskar Schindler becomes an unlikely humanitarian, spending his entire fortune to help save 1,100 Jews from Auschwitz during World War II.",2018.0
Inception,2010,8.8,"Action, Adventure, Sci-Fi",70131314,Movie,Inception,"United States, United Kingdom",2020-01-01,2010,PG-13,148 min,"Action & Adventure, Sci-Fi & Fantasy, Thrillers","In this mind-bending sci-fi thriller, a man runs an espionage business built around entering the subconscious of his targets to mold their thoughts.",2020.0
Mallesham,2019,8.8,Biography,81217739,Movie,Mallesham,India,2019-11-20,2019,TV-PG,131 min,"Dramas, Independent Movies, International Movies","A self-trained engineer risks debt, love and reputation in his quest to improve the grueling work conditions of his mother and her weaving community.",2019.0
Joker,2019,8.8,"Crime, Drama, Thriller",70219529,Movie,Joker,India,2018-08-02,2012,TV-PG,98 min,"Comedies, International Movies, Music & Musicals",A remote village situated neither in India or Pakistan becomes its own republic after inmates at the local mental asylum bust loose and take over.,2018.0
Merku Thodarchi Malai,2018,8.8,Drama,81045060,Movie,Merku Thodarchi Malai,India,2019-01-01,2018,TV-MA,115 min,"Dramas, Independent Movies, International Movies","In southern India, a laborer's dreams of owning a piece of land to farm is complicated by political corruption.",2019.0
Eh Janam Tumhare Lekhe,2015,8.7,Biography,80203792,Movie,Eh Janam Tumhare Lekhe,India,2017-12-01,2015,TV-14,124 min,"Dramas, International Movies","Driven by the lessons he learned from his mother, and the values of the Sikh religion, a man sets out on a mission to serve humanity.",2017.0
The Irishman,2019,8.7,"Biography, Crime, Drama",80175798,Movie,The Irishman,United States,2019-11-27,2019,R,209 min,Dramas,Hit man Frank Sheeran looks back at the secrets he kept as a loyal member of the Bufalino crime family in this acclaimed film from Martin Scorsese.,2019.0
The Lord of the Rings: The Two Towers,2002,8.7,"Adventure, Drama, Fantasy",60004483,Movie,The Lord of the Rings: The Two Towers,"New Zealand, United States",2020-01-01,2002,PG-13,179 min,"Action & Adventure, Sci-Fi & Fantasy","Frodo and Sam head to Mordor to destroy the One Ring of Power while Gimli, Legolas and Aragorn search for the orc-captured Merry and Pippin.",2020.0
The Matrix,1999,8.7,"Action, Sci-Fi",20557937,Movie,The Matrix,United States,2019-11-01,1999,R,136 min,"Action & Adventure, Sci-Fi & Fantasy","A computer hacker learns that what most people perceive as reality is actually a simulation created by machines, and joins a rebellion to break free.",2019.0
Drishyam,2013,8.6,"Crime, Drama, Thriller",80068117,Movie,Drishyam,India,2017-05-01,2015,TV-14,162 min,"Dramas, International Movies, Thrillers",An unexceptional man becomes a murder suspect when the son of a high-ranking police official who harassed his daughter goes missing.,2017.0
Koshish,1972,8.6,Drama,24073896,Movie,Koshish,India,2019-12-31,1972,TV-14,115 min,"International Movies, Romantic Movies",A speech and hearing-impaired couple persists through unforgiving obstacles to be accepted by society and live a life of dignity.,2019.0
Gol Maal,1979,8.6,"Comedy, Romance",21028086,Movie,Gol Maal,India,2019-12-31,1979,TV-PG,137 min,"Classic Movies, Comedies, International Movies","When circumstances at work compel Ram to pretend to have a twin, his lie works – until the boss wants his daughter to marry Ram’s fictitious brother.",2019.0
Once Upon a Time in the West,1968,8.5,Western,60031884,Movie,Once Upon a Time in the West,"Italy, United States",2019-11-20,1968,PG-13,166 min,"Action & Adventure, Classic Movies, International Movies","In this epic spaghetti Western, a flinty gunslinger is hired by a railroad tycoon to kill anyone standing in the way of his trans-American iron horse.",2019.0
Manto,2015,8.5,"Biography, Drama",81039383,Movie,Manto,India,2018-11-30,2018,TV-MA,114 min,"Dramas, Independent Movies, International Movies",The controversial and troubled Indo-Pakistani writer Saadat Hasan Manto finds his artistic choices challenged by censors.,2018.0
American History X,1998,8.5,Drama,18002692,Movie,American History X,United States,2019-11-01,1998,R,119 min,Dramas,A neo-Nazi gets sent to prison for murder and comes out a changed man. But can he prevent his younger brother from following in his footsteps?,2019.0
Punjab 1984,2014,8.5,"Drama, Family, History",80032364,Movie,Punjab 1984,"Canada, India",2017-11-01,2014,TV-14,158 min,"Dramas, International Movies","During a time of political turmoil, a mother goes on a journey in search of her missing son, who has been misjudged and labeled a terrorist.",2017.0
The Departed,2006,8.5,"Crime, Drama, Thriller",70044689,Movie,The Departed,United States,2019-12-01,2006,R,151 min,"Dramas, Thrillers",Two rookie Boston cops are sent deep undercover – one inside the gang of a charismatic Irish mob boss and the other double-crossing his own department.,2019.0
Masoom,1983,8.5,"Drama, Family, Musical",81213979,Movie,Masoom,India,2019-12-31,1983,TV-14,138 min,"Dramas, Independent Movies, International Movies",A loving husband and father's joyful family life is rocked to its core upon the discovery that he has a young son borne from a past extramarital affair.,2019.0
Qismat,2018,8.5,"Drama, Romance",81217747,Movie,Qismat,India,2019-12-01,2018,TV-PG,137 min,"Dramas, International Movies, Romantic Movies","A young villager moves to Chandigarh and falls for his bubbly neighbor, but their love story is affected by several heartbreaking twists of fate.",2019.0
Guru,1997,8.5,"Drama, Fantasy",70063017,Movie,Guru,India,2018-03-01,2007,TV-14,155 min,"Dramas, International Movies",Ambitious Gurukant Desai ignores his father's advice and leaves his village to find success in Turkey.,2018.0
Avengers: Infinity War,2018,8.5,"Action, Adventure, Sci-Fi",80219127,Movie,Avengers: Infinity War,United States,2018-12-25,2018,PG-13,150 min,"Action & Adventure, Sci-Fi & Fantasy",Superheroes amass to stop intergalactic sociopath Thanos from acquiring a full set of Infinity Stones and wiping out half of all life in the universe.,2018.0
Klaus,2019,8.5,"Animation, Adventure, Comedy",80183187,Movie,Klaus,Spain,2019-11-15,2019,PG,98 min,"Children & Family Movies, Comedies","A selfish postman and a reclusive toymaker form an unlikely friendship, delivering joy to a cold, dark town that desperately needs it.",2019.0
Chupke Chupke,1975,8.4,"Comedy, Drama, Romance",20255593,Movie,Chupke Chupke,India,2019-12-31,1975,TV-PG,127 min,"Classic Movies, Comedies, International Movies","Jealous of the high regard in which his new wife holds their brother-in-law, a botany professor stages an elaborate prank that will even the score.",2019.0
Love Ni Bhavai,2017,8.4,"Comedy, Drama, Romance",80990811,Movie,Love Ni Bhavai,India,2018-05-01,2017,TV-PG,163 min,"Comedies, International Movies, Romantic Movies","Not romantically inclined, a popular radio personality finds herself caught between two diametrically opposed suitors.",2018.0
Sadma,1983,8.4,Romance,70072558,Movie,Sadma,India,2019-12-31,1983,TV-14,137 min,"Dramas, International Movies, Romantic Movies","After a traumatic injury leaves her with amnesia and age regression, a young woman is sold to a brothel before a teacher becomes her savior.",2019.0
Spider-Man: Into the Spider-Verse,2018,8.4,"Animation, Action, Adventure",81002747,Movie,Spider-Man: Into the Spider-Verse,United States,2019-06-26,2018,PG,117 min,"Action & Adventure, Comedies","After being bitten by a radioactive spider, Brooklyn teen Miles Morales gets a crash course in web-slinging from his alternate-dimension counterparts.",2019.0
Dangal,2016,8.4,"Action, Biography, Drama",80166185,Movie,Dangal,India,2017-06-21,2016,TV-PG,161 min,"Dramas, International Movies, Sports Movies",A once-promising wrestler pursues the gold medal he never won by training two of his daughters to compete at the Commonwealth Games.,2017.0
Andhadhun,2018,8.4,"Crime, Thriller",81039381,Movie,Andhadhun,India,2018-12-16,2018,TV-14,137 min,"Comedies, Dramas, International Movies",A visually impaired pianist’s world careens into a series of shocking twists after he unintentionally lands at the murder scene of a former film star.,2018.0
The Lives of Others,2006,8.4,"Drama, Thriller",70056425,Movie,The Lives of Others,Germany,2019-03-15,2006,R,138 min,"Dramas, International Movies, Thrillers","As a secret police agent eavesdrops on a successful writer in East Germany in 1984, he becomes increasingly fascinated by the man's life and politics.",2019.0
Taare Zameen Par,2007,8.4,"Drama, Family",70087087,Movie,Taare Zameen Par,India,2017-12-08,2007,PG,162 min,"Dramas, International Movies","When daydreamer Ishaan is sent to boarding school, an unconventional art teacher tries to help the imaginative student discover his true identity.",2017.0
Tottaa Pataaka Item Maal,2019,8.4,Drama,81095399,Movie,Tottaa Pataaka Item Maal,India,2019-06-25,2018,TV-MA,107 min,"Dramas, Independent Movies, International Movies","Exasperated with living in perpetual fear for their safety, four women kidnap a man to show him the realities of being female in Delhi.",2019.0
Super Deluxe,2019,8.4,"Action, Crime, Drama",81128584,Movie,Super Deluxe,India,2019-06-29,2019,TV-MA,176 min,"Comedies, Dramas, International Movies","Sex, stigma and spirituality merge in these eccentric stories of an angsty teenager, an unfaithful wife and a transgender woman returning to her past.",2019.0
Joker,2016,8.4,"Comedy, Drama",70219529,Movie,Joker,India,2018-08-02,2012,TV-PG,98 min,"Comedies, International Movies, Music & Musicals",A remote village situated neither in India or Pakistan becomes its own republic after inmates at the local mental asylum bust loose and take over.,2018.0
3 Idiots,2009,8.4,"Comedy, Drama",70121522,Movie,3 Idiots,India,2019-08-01,2009,PG-13,164 min,"Comedies, Dramas, International Movies","While attending one of India's premier colleges, three miserable engineering students and best friends struggle to beat the school's draconian system.",2019.0
Much Ado About Nothing,2011,8.4,"Comedy, Romance",80098709,Movie,Much Ado About Nothing,"Chile, United States, France",2016-10-01,2016,NR,96 min,"Dramas, Independent Movies, International Movies",Carefree college student Vicente ends up in a desperate fight for freedom when a well-connected friend falsely accuses him of a hit-and-run accident.,2016.0
Harishchandrachi Factory,2009,8.4,"Biography, Comedy, Drama",70127589,Movie,Harishchandrachi Factory,India,2018-10-01,2009,TV-PG,99 min,"Dramas, International Movies","Against a backdrop of burgeoning social unrest, a neophyte filmmaker makes history in 1913 as the director of India's first feature-length film.",2018.0
Sairat,2016,8.3,"Drama, Romance",80124313,Movie,Sairat,India,2018-04-01,2016,TV-14,173 min,"Dramas, International Movies, Romantic Movies","When two college students – a rich man’s daughter and a fisherman’s son – defy social edicts by falling in love, violence erupts in their village.",2018.0
Article 15,2019,8.3,"Crime, Drama",81154455,Movie,Article 15,India,2019-09-06,2019,TV-MA,125 min,"Dramas, International Movies, Thrillers",The grim realities of caste discrimination come to light as an entitled but upright city cop ventures into India’s heartland to investigate a murder.,2019.0
American Beauty,1999,8.3,Drama,60000407,Movie,American Beauty,United States,2020-01-01,1999,R,122 min,Dramas,"While struggling to endure his tightly wound wife, an unfulfilling job and a surly teen, a man becomes obsessed with one of his daughter's friends.",2020.0
Inglourious Basterds,2009,8.3,"Adventure, Drama, War",70108777,Movie,Inglourious Basterds,"Germany, United States",2019-07-22,2009,R,153 min,Action & Adventure,"A Jewish cinema owner in occupied Paris is forced to host a Nazi premiere, where a group of American soldiers called the Basterds plans a face-off.",2019.0
Fandry,2013,8.3,"Drama, Family",80084454,Movie,Fandry,India,2018-01-01,2014,NR,102 min,"Dramas, Independent Movies, International Movies","Spunky, lower-caste lad Jabya falls for lovely, upper-caste Shalu. But his family's derided social position proves a stubborn stumbling block to love.",2018.0
Thithi,2015,8.3,Drama,80107370,Movie,Thithi,"India, United States",2017-03-09,2015,TV-MA,123 min,"Dramas, Independent Movies, International Movies","In a South Indian village, a centenarian's funeral brings together his free-spirited son, inheritance-hungry grandson and girl-crazy great-grandson.",2017.0
The Apartment,1960,8.3,"Comedy, Drama, Romance",80989867,TV Show,The Apartment,Singapore,2018-12-14,2014,TV-PG,2 Seasons,"International TV Shows, Reality TV","With their eyes on the grand prize, amateur designers push their creative limits in this reality competition show hosted by design icon Jamie Durie.",2018.0
Taxi Driver,1976,8.3,"Crime, Drama",18907685,Movie,Taxi Driver,United States,2019-07-01,1976,R,114 min,"Classic Movies, Dramas, Thrillers","Enraged by New York's moral rot and urban decay, an unhinged cab driver goes mad, plotting an assassination and saving a teen sex worker.",2019.0
Tikli and Laxmi Bomb,2017,8.3,Drama,81002213,Movie,Tikli and Laxmi Bomb,India,2018-08-01,2017,TV-MA,151 min,"Dramas, International Movies",Two frustrated sex workers cut out the middlemen from their business affairs and start a cooperative that's run entirely by women.,2018.0
Warrior,2011,8.2,"Drama, Sport",80193978,TV Show,Warrior,Denmark,2018-11-13,2018,TV-MA,1 Season,"Crime TV Shows, International TV Shows, TV Dramas",A war veteran plagued by guilt over his final mission teams up with his best friend's widow to infiltrate a dangerous Copenhagen biker gang.,2018.0
Andaz Apna Apna,1994,8.2,"Comedy, Family, Romance",20258084,Movie,Andaz Apna Apna,India,2018-05-16,1994,TV-PG,160 min,"Comedies, Cult Movies, International Movies","Broke and with no concrete plans for the future, two young men discover that a stunning heiress lives nearby and try to charm her into marriage.",2018.0
Pan's Labyrinth,2006,8.2,"Drama, Fantasy, War",70050507,Movie,Pan's Labyrinth,"Mexico, Spain",2020-01-01,2006,R,119 min,"Dramas, International Movies, Sci-Fi & Fantasy",Young Ofelia meets a mythical faun who claims she is destined to become princess of the Underworld. But first she must carry out three perilous tasks.,2020.0
Pink,2016,8.2,"Drama, Thriller",80144448,Movie,Pink,India,2017-01-20,2016,NR,130 min,"Dramas, International Movies","A sexual assault victim, unjustly tried for the attempted murder of her attacker, is defended by a retired lawyer who challenges India's rape culture.",2017.0
Queen,2013,8.2,"Comedy, Drama",80032081,Movie,Queen,India,2017-05-01,2014,TV-MA,138 min,"Comedies, Dramas, International Movies",A jilted bride decides to go on her European honeymoon anyway – by herself – and ends up embarking on a journey of self-discovery.,2017.0
Paan Singh Tomar,2012,8.2,"Action, Biography, Crime",70123126,Movie,Paan Singh Tomar,India,2018-11-01,2010,TV-MA,129 min,"Action & Adventure, Dramas, International Movies",Paan Singh Tomar goes from celebrated runner to star brigand and rebel when life after sports fails to unfold as planned.,2018.0
"Lock, Stock and Two Smoking Barrels",1998,8.2,"Comedy, Crime",16944044,Movie,"Lock, Stock and Two Smoking Barrels",United Kingdom,2019-01-01,1998,R,108 min,"Action & Adventure, Comedies, Independent Movies","Hoping to make a bundle in a high-stakes poker game, four shiftless lads from London's East End instead find themselves swimming in debt.",2019.0
V for Vendetta,2005,8.2,"Action, Drama, Sci-Fi",70039175,Movie,V for Vendetta,"United States, United Kingdom, Germany",2018-10-01,2005,R,132 min,"Action & Adventure, Dramas, Sci-Fi & Fantasy","A masked freedom fighter known as ""V"" takes up arms against a totalitarian government and finds an unlikely ally in a young woman.",2018.0
Udaan,2010,8.2,Drama,70139542,Movie,Udaan,India,2018-10-01,2010,TV-MA,137 min,"Dramas, Independent Movies, International Movies","Upon returning to his industrial hometown, a young man must decide whether to follow his own dreams or acquiesce to his father's plans for his future.",2018.0
Marriage Story,2019,8.2,"Comedy, Drama, Romance",80223779,Movie,Marriage Story,"United States, United Kingdom",2019-12-06,2019,R,137 min,Dramas,Academy Award-nominated filmmaker Noah Baumbach directs this incisive and compassionate look at a marriage coming apart and a family staying together.,2019.0
Ottaal,2014,8.2,Drama,80102080,Movie,Ottaal,India,2017-03-15,2014,TV-PG,88 min,"Dramas, International Movies","Young orphan Kuttappayi goes to live with his grandfather in the country, but his new life takes a hard turn when his grandfather's health fails.",2017.0
Sudani from Nigeria,2018,8.2,"Comedy, Sport",81013200,Movie,Sudani from Nigeria,India,2018-08-01,2018,TV-PG,115 min,"Comedies, Dramas, International Movies","When a soccer club manager brings one of his injured foreign players home to recuperate, they form an unlikely bond despite their cultural differences.",2018.0
Hera Pheri,2000,8.2,"Action, Comedy, Crime",20765027,Movie,Hera Pheri,India,2019-12-31,1976,TV-14,156 min,"Action & Adventure, Comedies, Dramas",The bond between two crooks and best friends is threatened when one learns that the other's father had a hand in his own tragic past.,2019.0
Black,2005,8.2,Drama,80214013,TV Show,Black,South Korea,2017-12-15,2017,TV-MA,1 Season,"Crime TV Shows, International TV Shows, Korean TV Shows","A Grim Reaper, a detective and a woman who foresees death get ensnared in matters of life and death – and dark mysteries of twenty years past.",2017.0
Rang De Basanti,2006,8.2,"Comedy, Drama",70047320,Movie,Rang De Basanti,India,2018-08-02,2006,TV-MA,159 min,"Dramas, International Movies",An idealistic English filmmaker casts a group of student actors in her docudrama about India's revolution against British rule in the 1920s.,2018.0
Raging Bull,1980,8.2,"Biography, Drama, Sport",70020699,Movie,Raging Bull,United States,2019-10-01,1980,R,129 min,"Classic Movies, Dramas, Sports Movies","This gritty biopic of brutal boxer Jake LaMotta portrays a tormented soul rising to the top of his sport, only to be undone by his demons.",2019.0
Monty Python and the Holy Grail,1975,8.2,"Adventure, Comedy, Fantasy",771476,Movie,Monty Python and the Holy Grail,United Kingdom,2019-01-02,1975,PG,92 min,"Action & Adventure, Classic Movies, Comedies",The Monty Python comedy clan skewers King Arthur and his Knights of the Round Table as they quest far and wide for the Holy Grail.,2019.0
Drishyam,2015,8.2,"Crime, Drama, Mystery",80068117,Movie,Drishyam,India,2017-05-01,2015,TV-14,162 min,"Dramas, International Movies, Thrillers",An unexceptional man becomes a murder suspect when the son of a high-ranking police official who harassed his daughter goes missing.,2017.0
Indiana Jones and the Last Crusade,1989,8.2,"Action, Adventure",60010487,Movie,Indiana Jones and the Last Crusade,United States,2019-01-01,1989,PG-13,127 min,"Action & Adventure, Children & Family Movies, Classic Movies","Accompanied by his father, Indiana Jones sets off on his third adventure to explore the cradle of civilization on a perilous hunt for the Holy Grail.",2019.0
Shonar Pahar,2018,8.1,Drama,81071868,Movie,Shonar Pahar,India,2019-02-22,2018,TV-14,131 min,"Dramas, Independent Movies, International Movies",An older woman's unique friendship with a young boy inspires her to examine the strained relationship she shares with her married son.,2019.0
Muramba,2017,8.1,"Comedy, Family",80223049,Movie,Muramba,India,2017-12-15,2017,TV-14,128 min,"Comedies, Dramas, International Movies",A young man and his parents ponder the reasons behind the recent breakdown of a relationship he was in – and the possibility of reconciliation.,2017.0
Kahaani,2012,8.1,"Mystery, Thriller",70236020,Movie,Kahaani,India,2019-06-26,2012,TV-14,122 min,"International Movies, Music & Musicals, Thrillers","Pregnant and alone in the city of Kolkata, a woman begins a relentless search for her missing husband, only to find that nothing is what it seems.",2019.0
Room,2015,8.1,"Drama, Thriller",80073823,Movie,Room,"Ireland, Canada, United Kingdom, United States",2018-07-19,2015,R,118 min,"Dramas, Independent Movies","Kidnapped, confined to a tiny room and raped, a young woman gives birth to a son. When he reaches his fifth birthday, she begins plotting an escape.",2018.0
Ugly,2013,8.1,"Crime, Drama, Mystery",70285730,Movie,Ugly,India,2017-03-01,2013,NR,125 min,"Dramas, International Movies, Thrillers","When a 10-year-old goes missing while her father, an actor, is out on an audition, the girl's stepfather – Mumbai's police chief – leads the search.",2017.0
Trainspotting,1996,8.1,Drama,60037022,Movie,Trainspotting,United Kingdom,2019-10-01,1996,R,94 min,"Comedies, Cult Movies, Dramas","Renton and his mates cope with the gritty realities of heroin addiction. But when Renton gets clean, he can't get away from his friends' nasty habits.",2019.0
Uyare,2019,8.1,Drama,81147274,Movie,Uyare,India,2019-08-14,2019,TV-14,119 min,"Dramas, International Movies",An aspiring pilot fights for her future – and justice – after surviving an acid attack from her abusive boyfriend.,2019.0
PK,2014,8.1,"Comedy, Drama, Fantasy",70303496,Movie,PK,India,2018-09-06,2014,TV-14,146 min,"Comedies, Dramas, International Movies",Aamir Khan teams with director Rajkumar Hirani to play a social crusader in a political satire on the state of corruption in India.,2018.0
Catch Me If You Can,2002,8.1,"Biography, Crime, Drama",60024942,Movie,Catch Me If You Can,"United States, Canada",2020-01-01,2002,PG-13,142 min,Dramas,"An FBI agent makes it his mission to put cunning con man Frank Abagnale Jr. behind bars. But Frank not only eludes capture, he revels in the pursuit.",2020.0
Shuddhi,2017,8.1,"Crime, Drama, Thriller",80188777,Movie,Shuddhi,"India, United States",2018-03-01,2017,TV-14,115 min,"Dramas, International Movies, Thrillers",An American woman on a revenge mission travels to India and befriends two journalists seeking justice for violent crimes against women.,2018.0
Zindagi Na Milegi Dobara,2011,8.1,"Comedy, Drama",70202336,Movie,Zindagi Na Milegi Dobara,India,2019-12-15,2011,TV-PG,154 min,"Comedies, Dramas, International Movies",Three friends on an adventurous road trip/bachelor party in Spain learn some lessons about themselves and each other that will change them forever.,2019.0
Haider,2014,8.1,"Action, Crime, Drama",70303432,Movie,Haider,India,2018-08-02,2014,TV-MA,154 min,"Dramas, International Movies, Romantic Movies",Shahid Kapoor delivers a searing performance in this Bollywood take on Hamlet that unfolds amid Kashmiri culture and history.,2018.0
Dil Chahta Hai,2001,8.1,"Comedy, Drama, Romance",60021525,Movie,Dil Chahta Hai,India,2019-12-15,2001,TV-14,185 min,"Comedies, Dramas, International Movies","Inseparable childhood friends Akash, Sameer and Siddharth are just out of college. Nothing comes between them – until they each fall in love.",2019.0
Barfi!,2012,8.1,"Comedy, Drama, Romance",70219525,Movie,Barfi!,India,2018-11-01,2012,TV-PG,144 min,"Comedies, Dramas, International Movies","Years after rejecting Barfii, a hearing and speech impaired young man, for a more ""appropriate"" suitor, Shruti finds herself falling for him.",2018.0
Persona,1966,8.1,"Drama, Thriller",80163530,TV Show,Persona,United States,2017-08-14,2015,TV-PG,1 Season,"Crime TV Shows, International TV Shows, TV Dramas",A private investigation firm takes on sensitive cases while its uniquely skilled agents deal with issues both inside and out of the office.,2017.0
A Wednesday,2008,8.1,"Crime, Drama, Mystery",70107499,Movie,A Wednesday,India,2018-11-01,2008,TV-MA,103 min,"Action & Adventure, Dramas, International Movies","After receiving an anonymous tip about a bomb, a police commissioner must negotiate with the terrorist, who demands the release of four militants.",2018.0
