Title,Release Year,imdb_rating,Genre,show_id,type,title,country,date_added,release_year,rating,duration,listed_in,description,year_added
Frank and Cindy,2015,6.1,Comedy,80085438,Movie,Frank and Cindy,United States,2016-04-01,2007,TV-MA,70 min,Documentaries,"Frank was a rising pop star when he married Cindy, but decades of dashed dreams and alcoholism have left the pair struggling to find happiness.",2016.0
How the Grinch Stole Christmas,2000,6.1,"Comedy, Family, Fantasy",60000901,Movie,How the Grinch Stole Christmas,United States,2017-06-01,2000,PG,105 min,"Children & Family Movies, Comedies",The Grinch decides to rob Whoville of Christmas – but a dash of kindness from little Cindy Lou Who and her family may be enough to melt his heart.,2017.0
Standoff,2016,6.1,"Drama, Thriller",80065754,Movie,Standoff,Canada,2018-12-11,2015,R,86 min,Action & Adventure,"After witnessing an assassin's slaughter, a young girl holes up in a farmhouse with a suicidal vet, who must use wits and guts to fend off the killer.",2018.0
Insidious,2008,6.1,"Drama, Mystery, Romance",70142542,Movie,Insidious,"United States, Canada, United Kingdom",2019-05-09,2010,PG-13,103 min,"Horror Movies, Thrillers","Hoping to leave their haunted house behind, a suburban family moves to a new place, only to learn the home wasn't haunted... but their eldest son is.",2019.0
Run,2014,6.1,Drama,70001082,Movie,Run,India,2018-03-01,2004,TV-14,134 min,"Action & Adventure, International Movies, Music & Musicals",Siddharth falls in love with beautiful Jhanvi. But Jhanvi's brother Ganpat is overly possessive – and determined to destroy their relationship.,2018.0
Kidnapping Mr. Heineken,2015,6.1,"Action, Crime, Drama",70299204,Movie,Kidnapping Mr. Heineken,"Netherlands, Belgium, United Kingdom, United States",2017-09-08,2015,R,95 min,"Action & Adventure, Dramas, International Movies","When beer magnate Alfred ""Freddy"" Heineken is kidnapped in 1983, his abductors make the largest ransom demand in history.",2017.0
Die Another Day,2002,6.1,"Action, Adventure, Thriller",60024927,Movie,Die Another Day,"United Kingdom, United States",2019-12-31,2002,PG-13,133 min,Action & Adventure,Pierce Brosnan's final outing as 007 finds James Bond facing off against a North Korean terrorist who's in league with a British diamond merchant.,2019.0
Personal Shopper,2016,6.1,"Drama, Horror, Mystery",80106984,Movie,Personal Shopper,"France, Germany, Czech Republic, Belgium",2019-02-01,2016,R,105 min,"Dramas, International Movies, Thrillers","A psychic medium takes a job as personal shopper for a spoiled celebrity in order to contact the spirit of her brother, who owned her employer's home.",2019.0
Between Two Ferns: The Movie,2019,6.1,Comedy,80243600,Movie,Between Two Ferns: The Movie,United States,2019-09-20,2019,TV-MA,83 min,Comedies,"Armed with awkward questions and zero self-awareness, Zach Galifianakis hits the road to find famous interview subjects for his no-budget talk show.",2019.0
Anon,2018,6.1,"Action, Crime, Drama",80195964,Movie,Anon,"Germany, United States, Canada",2018-05-04,2018,TV-MA,100 min,"Dramas, Sci-Fi & Fantasy, Thrillers","In a future where technology has rendered privacy obsolete, a detective investigates a serial assassin who has been deleted from all visual records.",2018.0
The Most Hated Woman in America,2017,6.1,"Biography, Drama, History",80082242,Movie,The Most Hated Woman in America,United States,2017-03-24,2017,TV-MA,93 min,Dramas,"This drama follows the controversial life of outspoken atheist Madalyn Murray O'Hair, from her landmark court battles to her infamous abduction.",2017.0
Headshot,2011,6.1,"Crime, Drama, Thriller",80109145,Movie,Headshot,Indonesia,2017-06-03,2016,TV-MA,119 min,"Action & Adventure, International Movies","When a young man wakes from a coma, memories of brutal violence begin to surface, putting his life – and that of his doctor – in jeopardy.",2017.0
Bee Movie,2007,6.1,"Animation, Adventure, Comedy",70060010,Movie,Bee Movie,"United States, Australia",2017-01-01,2007,PG,92 min,"Children & Family Movies, Comedies","Barry, a worker bee stuck in a dead-end job making honey, sues humans when he learns they've been stealing bees' nectar all along.",2017.0
Zoom,2015,6.1,"Animation, Comedy, Drama",80093812,Movie,Zoom,"Brazil, Canada",2016-12-15,2015,NR,93 min,"Comedies, Dramas, Independent Movies","Comic book artist Emma draws her ideal man: Edward, the director of a film about a novelist named Michelle, who's writing a book about Emma.",2016.0
Zoom,2015,6.1,"Animation, Comedy, Drama",81221873,Movie,Zoom,United States,2020-01-11,2006,PG,88 min,"Children & Family Movies, Comedies","Dragged from civilian life, a former superhero must train a new crop of youthful saviors when the military preps for an attack by a familiar villain.",2020.0
Smart People,2008,6.1,"Comedy, Drama, Romance",70084221,Movie,Smart People,United States,2019-07-12,2008,R,95 min,"Comedies, Dramas, Independent Movies",An unexpected romance and a surprise visit from his wild brother turn the life of widowed professor Lawrence Wetherhold upside down.,2019.0
Deidra & Laney Rob a Train,2017,6.1,"Comedy, Crime, Drama",80108984,Movie,Deidra & Laney Rob a Train,United States,2017-03-17,2017,TV-14,92 min,"Comedies, Dramas, Independent Movies","With their mother in jail and bills piling up, ambitious small-town teens Deidra and Laney plot a series of train robberies to keep themselves afloat.",2017.0
Pee-wee's Big Holiday,2016,6.1,"Comedy, Family",80031800,Movie,Pee-wee's Big Holiday,United States,2016-03-18,2016,TV-PG,90 min,"Children & Family Movies, Comedies, Cult Movies",A chance encounter with a mysterious stranger (Joe Manganiello) points Pee-wee toward his destiny – and his first-ever holiday!,2016.0
Indiana Jones and the Kingdom of the Crystal Skull,2008,6.1,"Action, Adventure",70084799,Movie,Indiana Jones and the Kingdom of the Crystal Skull,United States,2019-01-01,2008,PG-13,123 min,"Action & Adventure, Children & Family Movies, Sci-Fi & Fantasy","Indiana Jones is drawn into a Russian plot to unearth the Crystal Skulls of Akator, Amazonian artifacts with supernatural powers.",2019.0
Emo the Musical,2016,6.1,"Comedy, Music, Musical",80198055,Movie,Emo the Musical,Australia,2018-02-01,2016,PG-13,94 min,"Dramas, International Movies, Music & Musicals","Expelled from private school for attempted suicide, emo Ethan enters the world of Seymour High and meets a cute Christian who's ready to convert him.",2018.0
The Third Party,2016,6.1,"Comedy, Romance",80150350,Movie,The Third Party,Philippines,2019-03-21,2016,TV-MA,118 min,"Comedies, Dramas, International Movies","When aspiring fashion designer Andi reconnects with her ex-boyfriend Max, she's surprised to learn that he's in a relationship with a man.",2019.0
Once Upon a Time,1944,6.1,"Comedy, Fantasy",70197049,TV Show,Once Upon a Time,United States,2018-09-06,2018,TV-PG,7 Seasons,"TV Dramas, TV Sci-Fi & Fantasy","In this fantasy series, a young woman is drawn to a small Maine town and discovers that it's filled with elements of the fairy tale world.",2018.0
Abhinetri,2016,6.1,"Comedy, Horror",80150390,Movie,Abhinetri,India,2018-05-01,2016,TV-14,131 min,"Comedies, International Movies, Sci-Fi & Fantasy","Due to family pressure, a corporate man reluctantly marries a woman from the village, but in their new home, she abruptly assumes a different persona.",2018.0
Van Helsing,2004,6.1,"Action, Adventure, Fantasy",80121349,TV Show,Van Helsing,United States,2019-08-28,2018,TV-MA,3 Seasons,"International TV Shows, TV Action & Adventure, TV Dramas","After three years in a coma, Vanessa awakens to a world ravaged by vampires. Now, she and a motley band of fellow survivors fight to stay alive.",2019.0
Open Season,2006,6.1,"Animation, Adventure, Comedy",70043308,Movie,Open Season,United States,2019-09-01,2006,PG,86 min,"Children & Family Movies, Comedies","After saving a deer from a hunter's clutches, a domesticated grizzly finds himself relocated to the wild – and unprepared for the real world.",2019.0
Open Season,1974,6.1,"Action, Drama, Thriller",70043308,Movie,Open Season,United States,2019-09-01,2006,PG,86 min,"Children & Family Movies, Comedies","After saving a deer from a hunter's clutches, a domesticated grizzly finds himself relocated to the wild – and unprepared for the real world.",2019.0
Starsky & Hutch,2004,6.1,"Comedy, Crime",60033320,Movie,Starsky & Hutch,United States,2019-07-01,2004,PG-13,101 min,"Action & Adventure, Comedies",New undercover cop partners Starsky and Hutch must overcome their differences to solve an important case with help from street informant Huggy Bear.,2019.0
The Signal,2014,6.1,"Drama, Mystery, Sci-Fi",70300666,Movie,The Signal,United States,2018-07-13,2014,PG-13,97 min,"Sci-Fi & Fantasy, Thrillers","During their drive across the country, college pals Nick and Jonah – accompanied by Nick's girlfriend – run into major trouble in the Nevada desert.",2018.0
Inkheart,2008,6.1,"Adventure, Family, Fantasy",70101345,Movie,Inkheart,"Germany, United Kingdom, United States",2019-07-01,2008,PG,106 min,"Action & Adventure, Children & Family Movies, Sci-Fi & Fantasy","Unbeknownst to his 12-year-old daughter, a bookbinder has a secret ability to bring characters to life by reading their stories out loud.",2019.0
Kyaa Kool Hai Hum,2005,6.1,"Comedy, Mystery",70035357,Movie,Kyaa Kool Hai Hum,India,2019-05-15,2005,TV-14,165 min,"Comedies, International Movies, Music & Musicals","Longtime friends Rahul and Karan head to Mumbai intent on making their dreams come true, but both men are suddenly saddled with bad luck.",2019.0
Wanted,1967,6.1,"Action, Drama, Romance",80195522,TV Show,Wanted,Australia,2018-12-13,2018,TV-14,3 Seasons,"Crime TV Shows, International TV Shows, TV Dramas",Polar-opposite strangers Lola and Chelsea become partners on the run when they witness a murder involving dirty cops and are framed for the crime.,2018.0
Wanted,2010,6.1,Action,80195522,TV Show,Wanted,Australia,2018-12-13,2018,TV-14,3 Seasons,"Crime TV Shows, International TV Shows, TV Dramas",Polar-opposite strangers Lola and Chelsea become partners on the run when they witness a murder involving dirty cops and are framed for the crime.,2018.0
Milada,2017,6.1,"Biography, Drama, History",80108149,Movie,Milada,"Czech Republic, United States",2018-01-12,2017,TV-MA,124 min,"Dramas, International Movies",Politician and human rights campaigner Milada Horáková battles against all odds to defend her beliefs in a Czechoslovakia under Communist rule.,2018.0
The Signal,2007,6.1,"Horror, Sci-Fi, Thriller",70300666,Movie,The Signal,United States,2018-07-13,2014,PG-13,97 min,"Sci-Fi & Fantasy, Thrillers","During their drive across the country, college pals Nick and Jonah – accompanied by Nick's girlfriend – run into major trouble in the Nevada desert.",2018.0
Porto,2016,6.1,"Drama, Romance",80180225,Movie,Porto,"Portugal, France, Poland, United States",2018-04-16,2016,TV-MA,77 min,"Dramas, Independent Movies, Romantic Movies","In a coastal Portuguese city, an erotic encounter ensues between an American expat and a French student, resonating through their lives years later.",2018.0
Burn Out,2017,6.1,"Action, Thriller",80171678,Movie,Burn Out,"France, Belgium",2019-03-15,2017,TV-MA,104 min,"Action & Adventure, International Movies","When his son's mom runs afoul of Paris's criminal underworld, a thrill-seeking superbike racer begins moonlighting as a drug courier to clear her debt.",2019.0
Secrets in the Hot Spring,2018,6.1,"Comedy, Horror",81034612,Movie,Secrets in the Hot Spring,Taiwan,2018-12-31,2018,TV-14,108 min,"Comedies, Horror Movies, International Movies","When three teen outcasts arrive at a hot springs hotel to help run things, creepy incidents prompt comical efforts to find what lurks in their midst.",2018.0
Jonathan,1970,6.1,"Horror, Drama",81034599,Movie,Jonathan,United States,2019-04-16,2018,TV-MA,101 min,"Dramas, Independent Movies, Sci-Fi & Fantasy","Two siblings share a body, each getting it for 12 hours a day. But when one of them breaks the rules, their whole way of life comes crashing down.",2019.0
Two Lovers and a Bear,2016,6.1,"Adventure, Drama, Romance",80117082,Movie,Two Lovers and a Bear,Canada,2017-05-02,2016,R,95 min,"Dramas, Independent Movies, Romantic Movies",A troubled couple living near the North Pole begins a perilous journey south in an attempt to find peace and vanquish ghosts from the past.,2017.0
Honeymoon Travels Pvt. Ltd.,2007,6.1,"Comedy, Drama, Romance",70254352,Movie,Honeymoon Travels Pvt. Ltd.,India,2019-12-15,2007,TV-14,119 min,"Comedies, Dramas, International Movies",This offbeat comedy-drama follows six quirky newlywed couples as they set off on a bus from Mumbai to Goa on their honeymoons.,2019.0
7 Khoon Maaf,2011,6.1,"Drama, Mystery, Thriller",70139075,Movie,7 Khoon Maaf,India,2018-08-02,2011,TV-MA,148 min,"Dramas, International Movies, Thrillers","Spiced liberally with black comedy, this Bollywood drama follows the lethal love life of a woman who marries numerous men – only to find them flawed.",2018.0
Erased,2012,6.1,"Action, Thriller",80173711,TV Show,Erased,Japan,2017-12-15,2017,TV-14,1 Season,"International TV Shows, TV Dramas, TV Mysteries","After finding his mom killed, Satoru's time-traveling ability takes him back 18 years for a chance to prevent her death and those of three classmates.",2017.0
Invisible,2017,6.1,Drama,80232892,Movie,Invisible,"Argentina, France",2018-08-01,2017,TV-MA,87 min,"Dramas, Independent Movies, International Movies","After learning she's pregnant, a teen grapples with the consequences while trying to go about her life as if nothing has changed.",2018.0
Todd Glass: Stand-Up Special,2012,6.1,Comedy,81045511,Movie,Todd Glass: Stand-Up Special,United States,2018-12-31,2012,TV-MA,46 min,Stand-Up Comedy,"Standup comedian Todd Glass gets right down to it, with sly observations on accepting directions, denying compliments and being afraid of the dark.",2018.0
Inkaar,2013,6.1,"Drama, Romance, Thriller",70268489,Movie,Inkaar,India,2017-05-01,2013,NR,125 min,"Dramas, International Movies, Romantic Movies","An ad agency CEO is put under investigation when his ambitious protégée – and lover – accuses him of sexual harassment, vying for his top position.",2017.0
Zubaan,2015,6.1,Drama,80095531,Movie,Zubaan,India,2019-03-02,2015,TV-MA,111 min,"Dramas, International Movies, Music & Musicals","A scrappy but poor boy worms his way into a tycoon's dysfunctional family, while facing his fear of music and the truth about his past.",2019.0
Raja Natwarlal,2014,6.1,"Crime, Thriller",70303431,Movie,Raja Natwarlal,India,2018-11-01,2014,TV-14,131 min,"Dramas, International Movies, Thrillers",A small-time con man assembles a team to help him avenge the death of his partner-in-crime at the hands of a powerful gangster.,2018.0
Happy New Year,2011,6.1,"Drama, War",80017528,Movie,Happy New Year,India,2017-02-01,2014,TV-14,179 min,"Action & Adventure, Comedies, Dramas",A revenge-seeking diamond thief gathers a ragtag crew to infiltrate a Dubai hotel hosting a dance contest. But first they have to learn how to dance.,2017.0
My Entire High School Sinking Into the Sea,2016,6.1,"Animation, Comedy, Drama",80163053,Movie,My Entire High School Sinking Into the Sea,United States,2018-01-23,2016,PG-13,77 min,"Comedies, Independent Movies","After an earthquake sends their school building drifting into the sea, a group of high-schoolers struggles to survive and overcome clique wars.",2018.0
Burning Sands,2017,6.1,Drama,80097003,Movie,Burning Sands,United States,2017-03-10,2017,TV-MA,102 min,"Dramas, Independent Movies",Promising student Zurich opens his eyes to some hard truths when his fraternity's violent hazing escalates into a disastrous hell night.,2017.0
Déjà Vu,2013,6.1,Drama,81020692,TV Show,Déjà Vu,United States,2019-01-02,2013,TV-14,1 Season,"International TV Shows, Romantic TV Shows, TV Dramas","After losing everything, a prima ballerina accepts a stranger's offer to dial back time and reclaim what was taken from her – but at a great price.",2019.0
Wild Child,2008,6.1,"Comedy, Drama, Romance",70084791,Movie,Wild Child,"United States, United Kingdom, France",2019-11-01,2008,PG-13,98 min,"Comedies, Romantic Movies","When a spoiled girl pushes her father too far with her spending and outlandish behavior, he ships the Malibu princess off to a strict boarding school.",2019.0
Vanjagar Ulagam,2018,6.1,"Action, Crime, Drama",81045054,Movie,Vanjagar Ulagam,India,2018-12-15,2018,TV-MA,145 min,"Dramas, International Movies, Thrillers",Shyam wakes to discover he's suspected in a murder that one journalist believes may have ties to a mysterious gangster.,2018.0
Middle School: The Worst Years of My Life,2016,6.1,"Comedy, Family",80105067,Movie,Middle School: The Worst Years of My Life,"United States, Cambodia",2019-03-03,2016,PG,92 min,"Children & Family Movies, Comedies","At Hills Village Middle School, budding cartoonist Rafe and best pal Leo challenge their uptight principal by breaking every rule in his handbook.",2019.0
Man of Tai Chi,2013,6.1,"Action, Drama",70278930,Movie,Man of Tai Chi,"United States, China, Hong Kong",2018-07-26,2013,R,105 min,"Action & Adventure, Dramas","In this kung fu tale set in Beijing, a young man armed with incomparable martial arts skills gets embroiled in the world of underground fight clubs.",2018.0
Evolution,2001,6.1,"Comedy, Sci-Fi",60004471,Movie,Evolution,United States,2019-11-20,2001,PG-13,102 min,"Comedies, Sci-Fi & Fantasy","After two community college geology professors discover microscopic alien life-forms on a meteorite, the military and government become involved.",2019.0
Iceman,1984,6.1,"Drama, Sci-Fi",80003479,Movie,Iceman,"China, Hong Kong",2018-01-23,2014,R,104 min,"Action & Adventure, International Movies, Sci-Fi & Fantasy","Four hundred years after they were frozen in time, a Ming Dynasty guard and his three pursuers are defrosted to continue their ancient battle.",2018.0
Maniac,2012,6.1,"Horror, Thriller",80124522,TV Show,Maniac,United States,2018-09-21,2018,TV-MA,1 Season,"TV Comedies, TV Dramas, TV Mysteries",Two struggling strangers connect during a mind-bending pharmaceutical trial involving a doctor with mother issues and an emotionally complex computer.,2018.0
Maniac,2012,6.1,"Horror, Thriller",80133200,TV Show,Maniac,Norway,2017-09-01,2015,TV-MA,1 Season,"International TV Shows, TV Comedies, TV Dramas","A nondescript man in a mental hospital has an exciting life of adventure and romance – in his head. He may be insane, or maybe he's just having fun.",2017.0
Good Kids,2016,6.1,"Comedy, Drama",80119375,Movie,Good Kids,United States,2017-01-19,2016,R,90 min,"Comedies, Independent Movies",Four overachieving friends spend the summer after finishing high school doing everything possible to enjoy the party life and ruin their reputations.,2017.0
The Kissing Booth,2018,6.1,"Comedy, Romance",80143556,Movie,The Kissing Booth,"United Kingdom, United States",2018-05-11,2018,TV-14,105 min,"Comedies, Romantic Movies","When teenager Elle's first kiss leads to a forbidden romance with the hottest boy in high school, she risks her relationship with her best friend.",2018.0
The Perfection,2018,6.1,"Drama, Horror, Thriller",80211638,Movie,The Perfection,United States,2019-05-24,2019,TV-MA,91 min,"Horror Movies, LGBTQ Movies, Thrillers","In this twisty horror-thriller, a once-promising music prodigy reconnects with her former mentors, only to find them taken with a talented new pupil.",2019.0
Take Me,2017,6.1,"Comedy, Crime",80117747,Movie,Take Me,United States,2017-07-07,2017,TV-MA,84 min,"Comedies, Independent Movies","With his simulated kidnapping business flagging, an entrepreneur jumps at a weekend abduction opportunity – only to find the job isn't what it seems.",2017.0
Jericho,1937,6.1,"Drama, Musical, Adventure",70142437,TV Show,Jericho,United States,2017-08-16,2008,TV-14,2 Seasons,"Classic & Cult TV, TV Action & Adventure, TV Dramas","Jake returns to his Kansas town to collect an inheritance, but a nuclear blast cuts off the outside world and makes him a reluctant leader amid chaos.",2017.0
Gemini,2002,6.1,"Action, Comedy, Crime",80180851,Movie,Gemini,India,2018-07-01,2018,TV-PG,130 min,Dramas,"Despite growing up with traits that set her apart from her peers, a young adopted girl discovers her gift when she takes an interest in spelling bees.",2018.0
Jericho,2000,6.1,"Mystery, Western",70142437,TV Show,Jericho,United States,2017-08-16,2008,TV-14,2 Seasons,"Classic & Cult TV, TV Action & Adventure, TV Dramas","Jake returns to his Kansas town to collect an inheritance, but a nuclear blast cuts off the outside world and makes him a reluctant leader amid chaos.",2017.0
Catch Me If You Can,1989,6.1,"Action, Comedy, Drama",60024942,Movie,Catch Me If You Can,"United States, Canada",2020-01-01,2002,PG-13,142 min,Dramas,"An FBI agent makes it his mission to put cunning con man Frank Abagnale Jr. behind bars. But Frank not only eludes capture, he revels in the pursuit.",2020.0
Solomon Kane,2009,6.1,"Action, Adventure, Crime",70120167,Movie,Solomon Kane,"Czech Republic, United Kingdom, France",2018-02-15,2009,R,104 min,"Action & Adventure, International Movies, Sci-Fi & Fantasy","In this epic tale, a once-murderous sea captain is holed up in a monastery in retreat from the devil, whom the captain fears is coming for his soul.",2018.0
7:19,2016,6.0,"Drama, History",80134885,Movie,7:19,Mexico,2016-12-23,2016,TV-MA,93 min,"Dramas, International Movies","After a devastating earthquake hits Mexico City, trapped survivors from all walks of life wait to be rescued while trying desperately to stay alive.",2016.0
Winnie,2011,6.0,"Biography, Drama, History",80170119,Movie,Winnie,"France, Netherlands, South Africa, Finland",2018-02-26,2017,TV-14,85 min,"Documentaries, International Movies","Winnie Mandela speaks about her extraordinary and controversial career, from her early life to her marriage to her ongoing efforts to end apartheid.",2018.0
The Lovers,2017,6.0,"Comedy, Drama, Romance",80038446,Movie,The Lovers,"Belgium, India, Australia",2017-02-05,2015,R,109 min,"Action & Adventure, Dramas, Independent Movies","A magical ring holds the key to life, death and love for a marine archaeologist who seems to live two lives in different centuries and countries.",2017.0
Murder Mystery,2019,6.0,"Action, Comedy, Crime",80242619,Movie,Murder Mystery,United States,2019-06-14,2019,PG-13,98 min,Comedies,"On a long-awaited trip to Europe, a New York City cop and his hairdresser wife scramble to solve a baffling murder aboard a billionaire's yacht.",2019.0
Eyyvah Eyyvah 3,2014,6.0,Comedy,80038439,Movie,Eyyvah Eyyvah 3,Turkey,2017-03-10,2014,TV-PG,103 min,"Comedies, International Movies","Life is tough for Hüseyin after marrying his true love. He works day and night to support his growing family, while singer Firuzan copes with fame.",2017.0
Fifty,2015,6.0,"Drama, Romance, Thriller",80082739,Movie,Fifty,Nigeria,2015-12-28,2015,NR,101 min,"Dramas, International Movies","In Lagos, Nigeria, four successful women on the verge of 50 take stock of their lives and loves over the course of one week.",2015.0
Battle,2018,6.0,"Drama, Music, Romance",81002685,Movie,Battle,"Norway, Denmark, Netherlands, Sweden",2018-12-01,2018,TV-MA,98 min,"Dramas, International Movies, Romantic Movies","After Amalie's dad goes bankrupt, the young dancer's affluent life collapses. But she finds a new beat to follow after meeting hip-hop dancer Mikael.",2018.0
Phone Swap,2012,6.0,Comedy,81165771,Movie,Phone Swap,Nigeria,2019-09-01,2012,TV-14,112 min,"Comedies, International Movies, Romantic Movies",A fashion designer and an arrogant businessman reluctantly try to help each other after accidentally swapping phones in the airport.,2019.0
The Lovers,2017,6.0,"Comedy, Drama, Romance",80167628,Movie,The Lovers,United States,2019-11-05,2017,R,98 min,"Comedies, Dramas, Independent Movies","On the verge of divorce, a middle-aged couple, each involved in a serious affair, rethink their marriage and the meaning of love and fidelity.",2019.0
6-5=2,2013,6.0,"Horror, Thriller",80201826,Movie,6-5=2,India,2017-11-01,2014,TV-MA,103 min,"Horror Movies, International Movies, Thrillers","Six friends decide to undertake a grueling mountain trek, only to find that the difficulties in store for them are not merely physical.",2017.0
The Riot Club,2014,6.0,"Drama, Thriller",80017170,Movie,The Riot Club,United Kingdom,2017-03-16,2014,R,107 min,"Dramas, International Movies","After being drafted into an elite secret society, a pair of students at Oxford University see the group's extreme debauchery spiral out of control.",2017.0
Operator,2016,6.0,"Comedy, Drama",80106438,Movie,Operator,United States,2017-02-16,2016,TV-MA,91 min,"Comedies, Dramas, Independent Movies","When a programmer uses his wife's sympathetic voice for his company's customer service app, he starts to rely more on her idealized self than her.",2017.0
Backcountry,2014,6.0,"Drama, Horror, Thriller",80018336,Movie,Backcountry,Canada,2017-03-30,2014,NR,92 min,"Horror Movies, Independent Movies, Thrillers",A weekend hike for urbanites Alex and Jenn takes a dangerous turn when they become lost deep in the remote territory of a menacing bear.,2017.0
War Machine,2017,6.0,"Comedy, Drama, War",80068327,Movie,War Machine,United States,2017-05-26,2017,TV-MA,123 min,"Comedies, Dramas","When a proud general is tasked with winning an unpopular war, he takes the challenge head-on, not knowing that hubris may be his own worst enemy.",2017.0
Chennai Express,2013,6.0,"Action, Comedy",70254350,Movie,Chennai Express,India,2018-08-31,2013,TV-14,135 min,"Action & Adventure, Comedies, International Movies",What could have been a sad journey turns joyful for Rahul when he falls in love with a woman en route to submerging his grandfather's ashes.,2018.0
