Title,Release Year,imdb_rating,Genre,show_id,type,title,country,date_added,release_year,rating,duration,listed_in,description,year_added
Duck Butter,2018,5.3,"Comedy, Drama, Romance",80115118,Movie,Duck Butter,United States,2018-07-01,2018,TV-MA,94 min,"Dramas, Independent Movies, LGBTQ Movies","Wary of dishonesty in relationships, two young women embark on a 24-hour experiment on intimacy, but their romance flounders as the clock winds down.",2018.0
Superstar,2012,5.3,Drama,28631236,Movie,Superstar,United States,2019-11-20,1999,PG-13,82 min,Comedies,A socially awkward Catholic schoolgirl vows to win a dreamy classmate’s affections by taking first prize at an upcoming talent show.,2019.0
Jonas,2015,5.3,"Drama, Romance, Thriller",80119235,Movie,Jonas,Brazil,2017-02-26,2015,NR,97 min,"Dramas, International Movies","During Carnival, two teens from different classes meet years after being kept apart. Bad decisions lead the boy to hide with the girl inside a float.",2017.0
Natural Selection,1999,5.3,"Comedy, Thriller, Horror",80114915,Movie,Natural Selection,United States,2016-12-01,2015,R,101 min,"Dramas, Independent Movies","As the new kid, a shy high school senior finds himself tormented by all his peers except one. But his new friend has a dark, infectious outlook.",2016.0
The Island,1980,5.3,"Action, Adventure, Drama",81172901,Movie,The Island,Nigeria,2019-11-29,2018,TV-14,93 min,"Dramas, International Movies, Thrillers","When a colonel uncovers controversial intel about the government, he makes a shocking discovery and must decide whether to reveal it or risk his life.",2019.0
Malevolent,2002,5.3,"Crime, Drama, Thriller",80242081,Movie,Malevolent,United Kingdom,2018-10-05,2018,TV-MA,89 min,"Horror Movies, Thrillers","A brother-sister team who fake paranormal encounters for cash get more than they bargained for when a job at a haunted estate turns very, very real.",2018.0
Salaakhen,1998,5.3,"Action, Drama",80158479,Movie,Salaakhen,India,2017-04-01,1975,TV-14,134 min,"Action & Adventure, International Movies, Music & Musicals","Two close childhood friends take drastically different paths in life, but meet by chance years later and fall in love, unaware of their past bond.",2017.0
Spring Breakers,2012,5.3,"Crime, Drama",70257860,Movie,Spring Breakers,"United States, France",2018-07-15,2012,R,94 min,"Comedies, Cult Movies, Dramas","After four college girls rob a restaurant to fund their spring break in Florida, they get entangled with a weird dude with his own criminal agenda.",2018.0
Tusk,2014,5.3,"Comedy, Drama, Horror",80014857,Movie,Tusk,United States,2018-07-24,2014,R,102 min,Horror Movies,"When a wise-guy podcaster interviews a disabled seafarer, he decides to embark on a transformational quest to track down a dangerous walrus-monster.",2018.0
Khoobsurat,1999,5.3,"Action, Comedy, Romance",70303428,Movie,Khoobsurat,India,2018-10-01,2014,TV-14,121 min,"Comedies, International Movies, Romantic Movies",A free-spirited doctor is hired to assist an injured king and winds up challenging his family's tradition-bound lifestyle as she falls for his son.,2018.0
Match,2012,5.3,"Drama, History, Sport",70309693,Movie,Match,United States,2017-03-09,2014,R,92 min,"Dramas, Independent Movies","As a couple interviews a renowned dance professor for their dissertation, their probing questions soon betray a hidden agenda.",2017.0
The Forgotten,2014,5.3,Horror,80162143,Movie,The Forgotten,United Kingdom,2017-09-11,2014,TV-MA,89 min,Horror Movies,"After a teenager goes to live with his father in abandoned public housing, he hears strange noises and decides to investigate with his new friend.",2017.0
Seven in Heaven,2018,5.3,"Drama, Horror, Mystery",81017724,Movie,Seven in Heaven,United States,2018-10-06,2018,PG-13,94 min,Horror Movies,Two teenagers step into a secret closet and emerge in a terrifying alternate reality. They must find their way back before the door shuts forever.,2018.0
Wolves,2014,5.3,"Action, Fantasy, Horror",80170767,Movie,Wolves,United States,2019-03-29,2016,R,109 min,"Dramas, Independent Movies, Sports Movies",A promising high school basketball player has his eye on an Ivy League scholarship. But his father's secret addictions could ruin everything.,2019.0
Quicksand,2003,5.3,"Crime, Drama, Thriller",80211703,TV Show,Quicksand,Sweden,2019-04-05,2019,TV-MA,1 Season,"Crime TV Shows, International TV Shows, TV Dramas","After a tragedy at a school sends shock waves through a wealthy Stockholm suburb, a seemingly well-adjusted teen finds herself on trial for murder.",2019.0
XOXO,2016,5.3,"Drama, Music",80057691,Movie,XOXO,United States,2016-08-26,2016,TV-MA,92 min,Dramas,"The lives of a budding DJ, his loyal pal, a hopeless romantic, a jaded has-been and a troubled couple intersect at an electronic dance music festival.",2016.0
Barsaat,1995,5.3,"Action, Romance",284890,Movie,Barsaat,India,2018-04-01,1995,TV-PG,166 min,"Action & Adventure, International Movies, Music & Musicals","A naïve young man and a rich city girl fall in love. Her stepfather, however, doesn't approve of the match and will stop at nothing to split the pair.",2018.0
My Friend Pinto,2011,5.3,"Comedy, Crime, Drama",70213515,Movie,My Friend Pinto,India,2018-10-01,2011,TV-PG,100 min,"Comedies, International Movies, Sci-Fi & Fantasy",A bright-eyed villager comes face-to-face with the gritty realities of modern-day Mumbai when he sets out to find his childhood friend.,2018.0
Unaccompanied Minors,2006,5.3,"Adventure, Comedy, Family",70053456,Movie,Unaccompanied Minors,United States,2019-10-01,2006,PG,90 min,"Children & Family Movies, Comedies","Five disparate kids, snowed in at the airport on Christmas Eve, try to get back to their families and outsmart a disgruntled airport official.",2019.0
Detour,2013,5.3,"Horror, Romance, Thriller",80117765,Movie,Detour,"United Kingdom, South Africa",2017-05-25,2016,R,97 min,Thrillers,"Convinced his stepfather caused the crash that left his mother in a coma, a law student drunkenly agrees to his murder, then can't rescind the deal.",2017.0
Once Upon a Time,2017,5.3,"Drama, Fantasy, Romance",70197049,TV Show,Once Upon a Time,United States,2018-09-06,2018,TV-PG,7 Seasons,"TV Dramas, TV Sci-Fi & Fantasy","In this fantasy series, a young woman is drawn to a small Maine town and discovers that it's filled with elements of the fairy tale world.",2018.0
Revenge of the Green Dragons,2014,5.3,"Action, Crime, Drama",80017280,Movie,Revenge of the Green Dragons,"Hong Kong, United States",2018-07-21,2014,R,95 min,"Action & Adventure, Dramas, Independent Movies","In gritty 1980s New York, two Chinese immigrant boys rise through the ranks of the infamous Green Dragons gang, where they're trained to kill.",2018.0
Romantik Komedi,2010,5.3,"Comedy, Romance",80134438,Movie,Romantik Komedi,Turkey,2017-03-10,2010,NR,110 min,"Comedies, International Movies, Romantic Movies","Bored with her life and inspired by a friend's wedding, Esra quits her job and dumps her boyfriend, leading to a series of romantic misadventures.",2017.0
Race 2,2013,5.3,"Action, Crime, Thriller",70229046,Movie,Race 2,India,2018-10-01,2013,TV-14,139 min,"Action & Adventure, International Movies, Music & Musicals","In this sequel set in the world of horse racing, half-brothers Ranvir and Rajiv Singh return for another complex tale of love, greed and violence.",2018.0
Tall Girl,2019,5.3,Comedy,81002412,Movie,Tall Girl,United States,2019-09-13,2019,TV-PG,103 min,"Children & Family Movies, Comedies, Romantic Movies","After years of slouching through life, 6-foot-1 teen Jodi resolves to conquer her insecurities and gets caught up in a high school love triangle.",2019.0
Watchman,2019,5.3,Thriller,81155784,Movie,Watchman,India,2019-09-04,2019,TV-14,93 min,"Comedies, Dramas, International Movies","Rushing to pay off a loan shark, a young man breaks into a bungalow to steal the cash, unprepared for the dog standing guard – or the trouble inside.",2019.0
706,2019,5.3,Thriller,81086434,Movie,706,India,2019-04-01,2019,TV-14,118 min,"Horror Movies, International Movies","When a doctor goes missing, his psychiatrist wife treats the bizarre medical condition of a psychic patient, who knows much more than he's leading on.",2019.0
The Longshots,2008,5.3,"Biography, Comedy, Drama",70099120,Movie,The Longshots,United States,2019-01-30,2008,PG,95 min,"Comedies, Dramas, Sports Movies","When an 11-year-old girl becomes Pop Warner football's first female quarterback, she raises eyebrows – till she takes her team to the brink of glory.",2019.0
The Circle,2017,5.3,"Drama, Horror, Thriller",81044551,TV Show,The Circle,United States,2020-01-01,2020,TV-MA,1 Season,Reality TV,"Status and strategy collide in this social experiment and competition show where online players flirt, befriend and catfish their way toward $100,000.",2020.0
Budapest,2018,5.3,Comedy,80987464,Movie,Budapest,"France, Belgium",2019-03-01,2018,TV-MA,103 min,"Comedies, International Movies","Two best friends put their careers and marriages on the line when they launch a business hosting outrageous, anything-goes bachelor parties in Hungary.",2019.0
Jab Harry Met Sejal,2017,5.3,"Comedy, Drama, Romance",80206847,Movie,Jab Harry Met Sejal,India,2017-12-02,2017,TV-14,142 min,"Comedies, International Movies, Romantic Movies",A philandering tour guide in Europe begins to develop feelings for one of his clients while helping her search for her lost engagement ring.,2017.0
Amar,2017,5.3,"Drama, Romance",80113589,Movie,Amar,Spain,2017-07-15,2017,TV-MA,104 min,"Dramas, International Movies, Romantic Movies","Young Laura and Carlos experience the intensity and fragility of first love, as life realities gradually tarnish their idealized notions of romance.",2017.0
Çarsi Pazar,2015,5.3,Comedy,80134516,Movie,Çarsi Pazar,Turkey,2017-03-10,2015,TV-14,97 min,"Comedies, International Movies",The slacker owner of a public bath house rallies his community to save it when a big developer comes to town to close it down and open a new mall.,2017.0
Beyond Skyline,2017,5.3,"Action, Adventure, Horror",80189853,Movie,Beyond Skyline,"United Kingdom, China, Canada, Indonesia, Singapore, United States",2018-04-15,2017,R,107 min,"Action & Adventure, Sci-Fi & Fantasy","In the wake of an extraterrestrial invasion, a suspended L.A. cop teams up with survivors to stop the onslaught and rescue human captives.",2018.0
The Bad Batch,2016,5.3,"Drama, Horror, Romance",80099204,Movie,The Bad Batch,United States,2017-09-22,2016,R,119 min,"Dramas, Independent Movies, Thrillers","Banished to a wasteland of undesirables, a young woman struggles to find her feet among a drug-soaked desert society and an enclave of cannibals.",2017.0
Kath & Kimderella,2012,5.3,Comedy,81015524,Movie,Kath & Kimderella,Australia,2018-07-28,2012,TV-14,86 min,Comedies,"Chipper baby boomer Kath, diva daughter Kim and hapless pal Sharon visit Papilloma, Italy, where a royal romance and knockoff fashions await.",2018.0
Dil Hai Tumhaara,2002,5.3,"Drama, Romance",60033223,Movie,Dil Hai Tumhaara,India,2018-04-01,2002,TV-14,176 min,"Dramas, International Movies, Music & Musicals","The sophisticated son of a powerful businessman falls for a simple, free-spirited girl whose older sister is in love with him.",2018.0
Demonic,2015,5.3,"Horror, Thriller",70296443,Movie,Demonic,United States,2017-08-10,2015,R,83 min,"Horror Movies, Independent Movies","When amateur ghost hunters visit an abandoned house, their investigation turns into a massacre, leaving questions for a detective and a psychologist.",2017.0
The Chosen One,2007,5.3,"Animation, Action, Comedy",80233215,TV Show,The Chosen One,Brazil,2019-06-28,2019,TV-MA,1 Season,"International TV Shows, TV Dramas, TV Mysteries","Determined to bring a Zika vaccine to the remote Pantanal, three doctors clash with a faith healer and are pulled deeper into the mysteries of his cult.",2019.0
Yes or No 2.5,2015,5.3,"Comedy, Romance",81002597,Movie,Yes or No 2.5,Thailand,2018-11-08,2015,TV-PG,107 min,"International Movies, LGBTQ Movies, Romantic Movies","Roommates Wine and Pie find their lives turned upside down when two more ladies move in next door, bringing up past heartaches and new attractions.",2018.0
The Adderall Diaries,2015,5.3,"Crime, Drama, Thriller",80049979,Movie,The Adderall Diaries,United States,2018-07-15,2015,R,87 min,"Dramas, Thrillers",Author Stephen Elliott has a problem separating his own life from incidents in the life of a convicted murderer about whom he's writing a book.,2018.0
Yuva,2018,5.3,Drama,70001564,Movie,Yuva,India,2018-03-01,2004,TV-MA,160 min,"Dramas, International Movies","An accident on a bridge ties together three young men from different social classes, sparking a course of events that will forever alter their lives.",2018.0
The Doll 2,2017,5.3,"Horror, Thriller",81044857,Movie,The Doll 2,Indonesia,2019-01-15,2017,TV-MA,117 min,"Horror Movies, International Movies","A mother uses her deceased daughter’s doll as a medium to communicate with her, but the consequences are chilling. The second of the “Doll” films.",2019.0
The Green Inferno,2013,5.3,"Adventure, Horror",70293315,Movie,The Green Inferno,"United States, Spain, Chile, Peru",2019-11-16,2013,R,101 min,"Horror Movies, Independent Movies","Determined to save an Amazon tribe being squeezed by logging, a group of students finds nothing but trouble when their plane crashes in the jungle.",2019.0
Lavender,2016,5.3,"Drama, Thriller",81020716,TV Show,Lavender,Taiwan,2019-01-15,2002,TV-14,1 Season,"International TV Shows, Romantic TV Shows, TV Dramas","Before one of them moves to the U.S., two childhood friends promise to reunite as adults. But illness and the vagaries of the heart stand in the way.",2019.0
Lavender,2016,5.3,"Drama, Thriller",80125512,Movie,Lavender,"Canada, United States",2017-04-01,2016,NR,93 min,"Dramas, International Movies, Thrillers","After discovering old fractures in her skull, a photographer recovering from amnesia becomes increasingly haunted by a sinister childhood secret.",2017.0
Christmas with the Kranks,2004,5.3,"Comedy, Family",70011207,Movie,Christmas with the Kranks,United States,2019-01-01,2004,PG,99 min,"Children & Family Movies, Comedies",When Luther Krank and his wife opt to skip Christmas – no tree and no rooftop Frosty – can they handle the fallout from their family and neighbors?,2019.0
Honey 2,2011,5.3,"Comedy, Drama, Music",70184050,Movie,Honey 2,United States,2019-10-01,2011,PG-13,111 min,"Dramas, Romantic Movies","Determined to prove herself as a street dancer, Maria heads from juvie to a Bronx rec center where she's introduced to her dance idol, Honey Daniels.",2019.0
Jupiter Ascending,2015,5.3,"Action, Adventure, Sci-Fi",70301367,Movie,Jupiter Ascending,"United States, Australia",2019-08-01,2015,PG-13,128 min,"Action & Adventure, Sci-Fi & Fantasy",A young impoverished woman learns she's been predestined to change the fate of the universe after a genetically engineered hunter tracks her down.,2019.0
High Society,2017,5.3,Comedy,81026705,Movie,High Society,South Korea,2019-01-29,2018,TV-MA,137 min,"Dramas, International Movies","A deputy curator of a chaebol-funded art gallery and her husband, a politically ambitious economics professor, will do anything to join the über-elite.",2019.0
Brave New Jersey,2016,5.3,Comedy,80197310,Movie,Brave New Jersey,United States,2017-12-15,2016,TV-MA,92 min,"Comedies, Independent Movies",Small-town residents mistake an Orson Welles radio broadcast for news about an alien invasion and are emboldened to act as they await an apocalypse.,2017.0
Mercy,1995,5.3,"Crime, Drama, Thriller",80077402,Movie,Mercy,United States,2016-11-22,2016,TV-MA,88 min,"Dramas, Thrillers",Two brothers clash with their half-siblings when a visit home to see their dying mother surfaces old secrets and becomes a fight for survival.,2016.0
Lifechanger,2018,5.3,"Horror, Thriller",81087094,Movie,Lifechanger,Canada,2019-05-28,2018,TV-MA,84 min,"Horror Movies, Independent Movies, Thrillers","A shapeshifter has to kill, then inhabit his victims, or die. But as his need for new bodies speeds up, he finally faces down his own mortality.",2019.0
Dragonheart: Battle for the Heartfire,2017,5.3,Fantasy,80176756,Movie,Dragonheart: Battle for the Heartfire,United States,2017-06-13,2017,PG-13,98 min,"Action & Adventure, Sci-Fi & Fantasy","When the king of Brittania dies, the dragon who shares his heart must find a new ruler, but the monarch's grandchildren go to war over the throne.",2017.0
Rocky V,1990,5.3,"Drama, Sport",60025674,Movie,Rocky V,United States,2019-08-01,1990,PG-13,104 min,"Dramas, Sports Movies","Inspired by the memory of his trainer, a broke and seemingly careerless Rocky finds glory in training and takes on an up-and-coming boxer.",2019.0
Pottersville,2017,5.3,Comedy,80217545,Movie,Pottersville,United States,2017-12-15,2017,PG-13,86 min,"Comedies, Independent Movies","A man's drunken romp in a gorilla suit gets him mistaken for Bigfoot, drawing media attention and tourist dollars to his struggling small town.",2017.0
Sisterakas,2012,5.3,Comedy,81010867,Movie,Sisterakas,Philippines,2019-03-07,2012,TV-14,105 min,"Comedies, International Movies","Two half siblings separated by family conflict cross paths as adults at a fashion agency – but one of them has a vendetta, unbeknownst to the other.",2019.0
Intersection,1994,5.3,"Drama, Romance",80149594,TV Show,Intersection,Turkey,2017-07-01,2016,TV-14,3 Seasons,"International TV Shows, Romantic TV Shows, TV Dramas","Two wealthy businessmen with car obsessions cross paths with an idealist pediatrician. Love enters the equation, and their lives change for good.",2017.0
Sinister 2,2015,5.3,"Horror, Mystery, Thriller",80043834,Movie,Sinister 2,"United States, United Kingdom",2019-10-16,2015,R,97 min,Horror Movies,"A single mother and her twin sons move into a rural house, unaware of its history of being inhabited by an evil spirit that preys upon young children.",2019.0
Still,2014,5.3,Thriller,80999985,Movie,Still,Thailand,2018-09-14,2010,TV-MA,100 min,"Horror Movies, International Movies","A haunted hotel, a body in a water tank, a nightclub fire and a prison death comprise four horror tales taken from Thailand's newspaper headlines.",2018.0
A Kind of Murder,2016,5.3,"Crime, Drama, Thriller",80134149,Movie,A Kind of Murder,United States,2017-05-01,2016,R,96 min,Thrillers,"Obsessed with an unsolved murder case, a crime novelist stuck in an unhappy marriage fantasizes about killing his wife, who soon turns up dead.",2017.0
Veerappan,2016,5.3,"Action, Biography, Crime",80201822,Movie,Veerappan,India,2017-10-15,2016,TV-14,117 min,"Action & Adventure, Dramas, International Movies",A police official assembles an elaborate network of spies and undercover operatives to bring down a ruthless bandit with a private army.,2017.0
God Bless the Broken Road,2018,5.3,"Drama, Family, Romance",80131616,Movie,God Bless the Broken Road,United States,2019-02-09,2018,PG,111 min,"Children & Family Movies, Dramas, Faith & Spirituality","After a young mother is widowed by war, her faith is tested as she struggles to stay afloat financially and raise her daughter.",2019.0
Convict,2014,5.3,"Action, Crime, Drama",81035853,Movie,Convict,United States,2019-06-13,2014,TV-MA,97 min,"Dramas, International Movies","Sentenced to death for committing rape, a convict navigates his final trying days alongside his allies and enemies in prison.",2019.0
Head Count,2018,5.3,"Horror, Mystery, Thriller",81037283,Movie,Head Count,United States,2019-09-13,2018,TV-MA,90 min,"Horror Movies, Independent Movies",A group of college students on a weekend getaway accidentally summon a supernatural entity intent on using them for its deadly ritual.,2019.0
The Oath,2018,5.3,"Comedy, Thriller",80156405,Movie,The Oath,Iceland,2017-12-08,2016,TV-MA,104 min,"Action & Adventure, International Movies",The ordered life of a Reykjavik heart surgeon unravels when his daughter descends into a life of drugs and crime thanks to a sinister boyfriend.,2017.0
The Neighbor,2018,5.3,"Romance, Thriller",80990609,TV Show,The Neighbor,Spain,2019-12-31,2019,TV-MA,1 Season,"International TV Shows, Spanish-Language TV Shows, TV Comedies",Self-centered Javier's life gets a bit messy when he unexpectedly becomes a superhero – and his recent ex is tasked with uncovering his identity.,2019.0
Amar Akbar & Tony,2015,5.3,"Comedy, Drama, Romance",80173234,Movie,Amar Akbar & Tony,United Kingdom,2017-06-20,2015,TV-MA,92 min,"Comedies, Dramas, International Movies","The brotherly bond between three childhood friends – one Sikh, one Muslim and one Catholic – is tested by the often comic absurdities of adulthood.",2017.0
The Oath,2018,5.3,"Comedy, Thriller",80157567,TV Show,The Oath,Singapore,2017-07-01,2011,TV-PG,1 Season,"International TV Shows, Romantic TV Shows, TV Dramas","Two doctors with opposite approaches to treating patients clash on the job and must learn to trust each other's expertise, allowing love to bloom.",2017.0
Jackpot,2019,5.3,"Action, Comedy",81002592,Movie,Jackpot,Vietnam,2018-10-06,2015,TV-14,92 min,"Comedies, Dramas, International Movies",A lottery ticket salesperson faces an ethical dilemma after setting aside a soon-to-be winning ticket for a customer to pick up and pay for later.,2018.0
Never Heard,2018,5.2,"Drama, Family",80216820,Movie,Never Heard,United States,2019-02-15,2018,TV-14,89 min,"Dramas, Faith & Spirituality","As his father sits behind bars, a young man is lured into Los Angeles' merciless drug world and forced to choose between God and gang life.",2019.0
All Hallows' Eve,2016,5.2,Family,80190149,Movie,All Hallows' Eve,United States,2017-08-01,2016,TV-G,92 min,"Children & Family Movies, Independent Movies","Instead of summoning the spirit of her dearly departed mother, a charming teen accidentally awakens a vengeful witch who wants to destroy her town.",2017.0
Lost in Space,1998,5.2,"Action, Adventure, Family",80104198,TV Show,Lost in Space,United States,2018-04-13,2018,TV-PG,1 Season,"TV Action & Adventure, TV Dramas, TV Sci-Fi & Fantasy","After crash-landing on an alien planet, the Robinson family fights against all odds to survive and escape. But they're surrounded by hidden dangers.",2018.0
Shabd,2005,5.2,Drama,70027133,Movie,Shabd,India,2019-04-15,2005,TV-14,146 min,"Dramas, International Movies, Romantic Movies","When a novelist seeks inspiration by urging his wife to have an affair, the line between his story and his real life grows disconcertingly blurry.",2019.0
The Worthy,2016,5.2,"Action, Sci-Fi, Thriller",80191513,Movie,The Worthy,"United Arab Emirates, Romania",2017-12-01,2016,TV-MA,99 min,"International Movies, Sci-Fi & Fantasy, Thrillers","In the near future, with civilization a thing of the past, a man puts his family in peril when he reluctantly lets outsiders into his compound.",2017.0
Trash,2009,5.2,Drama,70307648,Movie,Trash,"United Kingdom, Brazil, Germany",2019-01-01,2014,R,114 min,"Dramas, Independent Movies, Thrillers","Three poor Brazilian teens find something suspicious in a garbage heap, then end up on the run from the law as they try to set things right.",2019.0
Girlfriend's Day,2017,5.2,"Comedy, Drama",80081987,Movie,Girlfriend's Day,United States,2017-02-14,2017,TV-MA,71 min,"Comedies, Independent Movies","When he's caught up in a deadly conspiracy, an unemployed greeting card writer must create the perfect card for a new holiday to save his skin.",2017.0
Dad's Army,2016,5.2,"Comedy, War",80244567,TV Show,Dad's Army,United Kingdom,2018-03-31,1977,TV-PG,10 Seasons,"British TV Shows, Classic & Cult TV, TV Comedies",This beloved sitcom follows the unlikely heroes of the volunteer British Home Guard as they prepare for German invasion in World War II.,2018.0
Open Season,1995,5.2,Comedy,70043308,Movie,Open Season,United States,2019-09-01,2006,PG,86 min,"Children & Family Movies, Comedies","After saving a deer from a hunter's clutches, a domesticated grizzly finds himself relocated to the wild – and unprepared for the real world.",2019.0
Ghost Rider,2007,5.2,"Action, Fantasy, Thriller",70044594,Movie,Ghost Rider,"United States, Australia",2020-01-01,2007,PG-13,110 min,"Action & Adventure, Sci-Fi & Fantasy","Stunt cyclist Johnny Blaze makes a bargain with the sinister Mephisto to save a loved one. Years later, Johnny gets the chance to reclaim his soul.",2020.0
Garbage,2012,5.2,"Comedy, Drama",80994130,Movie,Garbage,India,2018-09-01,2018,TV-MA,109 min,"Dramas, Independent Movies, International Movies",The lives of a fundamentalist online troll and a woman reeling from a sex tape gone viral become dangerously intertwined in this provocative thriller.,2018.0
Fun Mom Dinner,2017,5.2,Comedy,80168234,Movie,Fun Mom Dinner,United States,2017-12-31,2017,R,82 min,"Comedies, International Movies","Four preschool moms with little in common need a night out to take a break from their kids. But one thing leads to another, and things get rowdy.",2017.0
Social Animals,2018,5.2,Comedy,81054383,Movie,Social Animals,United States,2019-03-19,2018,TV-MA,87 min,Documentaries,"This documentary follows a trio of teens – a daredevil photographer, an aspiring model and a lonely Ohio girl – and Instagram's impact on their lives.",2019.0
Lang Tong,2014,5.2,Thriller,81036535,Movie,Lang Tong,Singapore,2018-12-20,2015,TV-MA,82 min,"International Movies, Thrillers","After seducing a philandering con man, a rebellious young woman enlists his help in carrying out a heinous crime against her sister.",2018.0
Bushwick,2017,5.2,"Action, Adventure, Drama",80174220,Movie,Bushwick,United States,2017-11-24,2017,TV-MA,94 min,"Action & Adventure, Independent Movies","When their diverse neighborhood is besieged by a mysterious militia, a grad student and an ex-Marine become an unlikely team in a battle for survival.",2017.0
