Title,Release Year,imdb_rating,Genre,show_id,type,title,country,date_added,release_year,rating,duration,listed_in,description,year_added
La Bamba,1987,6.9,"Biography, Drama, Music",281550,Movie,La Bamba,United States,2020-01-01,1987,PG-13,109 min,"Classic Movies, Dramas, Music & Musicals","The plane crash that killed Buddy Holly also took Ritchie Valens, whose modest upbringing and rise to fame are depicted in this exhilarating biopic.",2020.0
Carbon,2018,6.9,"Adventure, Thriller",81005312,Movie,Carbon,"France, Belgium",2018-09-01,2017,TV-MA,104 min,"Dramas, International Movies, Thrillers","On the verge of losing his business, an entrepreneur launches a carbon tax scam that thrusts him into a web of criminals, intrigue and murder.",2018.0
Hairspray,1988,6.9,"Comedy, Drama, Family",70065096,Movie,Hairspray,"United States, United Kingdom, Canada",2020-01-01,2007,PG,116 min,"Children & Family Movies, Comedies, Music & Musicals","In 1962, ambitious plus-size teen Tracy Turnblad tries to integrate a racially divided Baltimore one Watusi at a time.",2020.0
Melvin Goes to Dinner,2003,6.9,"Comedy, Drama, Romance",60029032,Movie,Melvin Goes to Dinner,United States,2018-07-01,2003,R,84 min,"Comedies, Dramas, Independent Movies","When Melvin and his friends gather for dinner, their casual conversation takes a sharp turn as they begin to disclose raw truths about themselves.",2018.0
Kaalia,1981,6.9,"Action, Drama",20712279,Movie,Kaalia,India,2019-12-31,1981,TV-14,173 min,"Action & Adventure, Dramas, International Movies","Jailed for robbing his brother’s unscrupulous employer, a simpleton has a transformation while in prison, emerging with a violent mission for revenge.",2019.0
Arthur,1981,6.9,"Comedy, Romance",70167072,Movie,Arthur,United States,2019-04-01,2011,PG-13,110 min,"Comedies, Romantic Movies",Russell Brand stars in this remake as a philanderer who must decide whether to give up an inheritance of millions for the sake of romance.,2019.0
Bad Boys,1995,6.9,"Action, Comedy, Crime",269880,Movie,Bad Boys,United States,2019-10-01,1995,R,119 min,"Action & Adventure, Comedies","In this fast-paced actioner, two Miami narcotics cops are hot on the trail of a master crook who has snatched $100 million worth of heroin.",2019.0
Calendar Girls,2003,6.9,"Comedy, Drama",80202089,Movie,Calendar Girls,India,2017-10-15,2015,TV-14,126 min,"Dramas, International Movies",Five calendar models try to navigate the twists and turns thrown in their path by the seductive and ruthless world of glamour.,2017.0
Patriot Games,1992,6.9,"Action, Thriller",846071,Movie,Patriot Games,United States,2020-01-01,1992,R,117 min,Action & Adventure,CIA desk jockey Jack Ryan plunges into the heart of international terrorism after spoiling an assassination attempt on a British royal family member.,2020.0
We the Animals,2018,6.9,Drama,80241304,Movie,We the Animals,United States,2019-02-11,2018,R,93 min,"Dramas, Independent Movies","A trio of brothers cope with their parents' volatile relationship by running wild and unchecked, and one of them experiences a visceral awakening.",2019.0
Barcelona: A Love Untold,2016,6.9,"Drama, Romance",80145621,Movie,Barcelona: A Love Untold,Philippines,2019-03-14,2016,TV-14,132 min,"Dramas, International Movies, Romantic Movies","While pursuing a degree in Spain, an architecture student struggling with grief meets a fellow expatriate trying to flee a difficult family life.",2019.0
Clash of the Titans,1981,6.9,"Action, Adventure, Family",70119812,Movie,Clash of the Titans,"United States, United Kingdom, Australia",2019-08-01,2010,PG-13,106 min,"Action & Adventure, Sci-Fi & Fantasy","If he is to save the life of the beautiful Princess Andromeda, the valiant Perseus must battle a host of powerful, beastly enemies.",2019.0
Requiem,2006,6.9,"Drama, Horror",80184068,TV Show,Requiem,United Kingdom,2018-03-23,2018,TV-MA,1 Season,"British TV Shows, International TV Shows, TV Dramas","In the wake of a sudden tragedy, a London cellist unearths secrets that link her mother to the disappearance of a young girl in a small Welsh town.",2018.0
Stripes,1981,6.9,"Comedy, War",1008581,Movie,Stripes,United States,2019-09-01,1981,R,106 min,"Classic Movies, Comedies, Cult Movies","After losing everything, an indolent sad sack impulsively joins the U.S. Army and cajoles his best friend into enlisting, too.",2019.0
Slow West,2015,6.9,"Action, Adventure, Western",80029901,Movie,Slow West,"United Kingdom, New Zealand",2018-07-26,2015,R,84 min,"Action & Adventure, Dramas, International Movies","Determined to find the woman he loves, a Scottish teenager braves the Western frontier of 19th-century America, with bounty hunters hot on his trail.",2018.0
The Highwaymen,2019,6.9,"Biography, Crime, Drama",80200571,Movie,The Highwaymen,United States,2019-03-29,2019,R,132 min,Dramas,Two steely former Texas Rangers are tasked with tracking and killing infamous criminals Bonnie and Clyde in this crime drama based on real events.,2019.0
Man Up,2015,6.8,"Comedy, Drama, Romance",80052612,Movie,Man Up,"United Kingdom, France",2018-09-04,2015,R,88 min,"Comedies, International Movies, Romantic Movies","A single woman seizes an opportunity when, while standing under a train station clock, she meets a stranger who mistakes her for his blind date.",2018.0
Barah Aana,2009,6.8,"Comedy, Crime, Drama",80083672,Movie,Barah Aana,India,2019-12-31,2009,TV-14,95 min,"Dramas, International Movies","After futile attempts to better their lives with honest work, three broke friends opt for a more dubious means of making money: kidnapping for ransom.",2019.0
Panic Room,2002,6.8,"Crime, Drama, Thriller",60022700,Movie,Panic Room,United States,2019-08-01,2002,R,112 min,Thrillers,A woman and her daughter are caught in a game of cat-and-mouse with burglars in their New York City home and are forced to retreat inside a vault.,2019.0
Master,1997,6.8,"Action, Drama",80163352,Movie,Master,South Korea,2018-02-01,2016,NR,143 min,"Action & Adventure, International Movies","Needing hard evidence to convict a company chairman of fraud, an investigator bargains with the company's tech expert to turn over his boss's ledger.",2018.0
Jal,2013,6.8,Drama,80028360,Movie,Jal,India,2017-10-15,2013,TV-14,132 min,"Dramas, Independent Movies, International Movies",A gifted young man from a drought-stricken village helps a group of ecologists find water for migrating flamingoes.,2017.0
Moshe Kasher: Live in Oakland,2012,6.8,Comedy,70256512,Movie,Moshe Kasher: Live in Oakland,United States,2019-01-01,2012,TV-MA,61 min,Stand-Up Comedy,Comic Moshe Kasher returns to his home turf of Oakland for this stand-up special that has him sharing uproarious stories about the people he's met.,2019.0
Insidious,2010,6.8,"Horror, Mystery, Thriller",70142542,Movie,Insidious,"United States, Canada, United Kingdom",2019-05-09,2010,PG-13,103 min,"Horror Movies, Thrillers","Hoping to leave their haunted house behind, a suburban family moves to a new place, only to learn the home wasn't haunted... but their eldest son is.",2019.0
The Score,2001,6.8,"Crime, Drama, Thriller",60020826,Movie,The Score,"Germany, Canada, United States",2019-11-28,2001,R,124 min,"Dramas, Thrillers","Ready-to-retire safecracker Nick, flamboyant fence Max and talented but volatile thief Jackie team up to rob the Montreal Customs House.",2019.0
I Am Mother,2019,6.8,"Drama, Horror, Sci-Fi",80227090,Movie,I Am Mother,Australia,2019-06-07,2019,TV-14,114 min,"International Movies, Sci-Fi & Fantasy, Thrillers","Following humanity's mass extinction, a teen raised alone by a maternal droid finds her entire world shaken when she encounters another human.",2019.0
Hellboy,2004,6.8,"Action, Adventure, Fantasy",60034549,Movie,Hellboy,United States,2018-12-01,2004,PG-13,122 min,"Action & Adventure, Cult Movies, Sci-Fi & Fantasy","This fast-paced action flick tells the dark story of Hellboy, a charismatic demon who's put on Earth by the Nazis to terrorize the rest of the world.",2018.0
Teen Aur Aadha,2018,6.8,Drama,81094082,Movie,Teen Aur Aadha,India,2019-04-29,2018,TV-MA,119 min,"Dramas, Independent Movies, International Movies","At a 50-year-old house that served as a school, a brothel, and now a home, tales unfold of the residents who have lived there, longing for an escape.",2019.0
A Ghost Story,2017,6.8,"Drama, Fantasy, Romance",80173542,Movie,A Ghost Story,United States,2020-01-07,2017,R,92 min,"Dramas, Independent Movies","Following a fatal car crash, a man's spirit remains stuck in the home he shared with his wife as doors into the past and future begin to open.",2020.0
The Jane Austen Book Club,2007,6.8,"Comedy, Drama, Romance",70074299,Movie,The Jane Austen Book Club,United States,2019-03-08,2007,PG-13,106 min,"Comedies, Dramas, Romantic Movies",Six book club members find their lives resemble a modern-day version of Jane Austen's novels in this drama.,2019.0
Yes Man,2008,6.8,"Comedy, Romance",70100379,Movie,Yes Man,"United States, United Kingdom",2020-01-01,2008,PG-13,104 min,"Comedies, Romantic Movies","After a bitter divorce, a bank drone falls under the sway of a self-help guru who urges him to say yes to everything that comes his way for a year.",2020.0
The Imaginarium of Doctor Parnassus,2009,6.8,"Adventure, Comedy, Fantasy",70113532,Movie,The Imaginarium of Doctor Parnassus,"United Kingdom, Canada, France, United States",2019-03-08,2009,PG-13,123 min,"Action & Adventure, Sci-Fi & Fantasy","When a deal with the devil comes due, the immortal Doctor Parnassus must renegotiate the pact to save his daughter and right the wrongs of his past.",2019.0
Chappie,2015,6.8,"Action, Crime, Drama",80016588,Movie,Chappie,"South Africa, United States",2019-01-01,2015,R,121 min,"Action & Adventure, Sci-Fi & Fantasy","In a futuristic society where a robot police force keeps crime at bay, a lone droid gains the power of artificial intelligence.",2019.0
Jay and Silent Bob Strike Back,2001,6.8,Comedy,60004476,Movie,Jay and Silent Bob Strike Back,United States,2019-01-01,2001,R,105 min,"Comedies, Cult Movies","Jay and Silent Bob's comic book alter egos have been sold to Hollywood without permission, so they head to Tinseltown to sabotage the production.",2019.0
Naan Sigappu Manithan,1985,6.8,"Action, Crime, Drama",80190103,Movie,Naan Sigappu Manithan,India,2018-10-01,2014,TV-MA,147 min,"Action & Adventure, Dramas, International Movies","After his sleeping disorder hinders him from protecting his girlfriend, a man sets out to take revenge on the thugs who attacked her.",2018.0
Maktub,2011,6.8,"Comedy, Drama",80244547,Movie,Maktub,Israel,2018-06-15,2018,TV-MA,106 min,"Comedies, International Movies","After surviving a bomb attack, two low-level mobsters in Jerusalem change their ways and set about making strangers' Wailing Wall prayers come true.",2018.0
Life,1999,6.8,"Comedy, Crime, Drama",70225722,TV Show,Life,"United Kingdom, United States, Greece, Italy, Germany",2015-04-22,2009,TV-PG,1 Season,"British TV Shows, Docuseries, International TV Shows",Discover the glorious variety of life on Earth and the spectacular and extraordinary tactics animals and plants have developed to stay alive.,2015.0
National Treasure,2004,6.8,"Action, Adventure, Mystery",70011206,Movie,National Treasure,United States,2018-06-01,2004,PG,131 min,"Action & Adventure, Children & Family Movies","Modern treasure hunters search for a chest of riches rumored to have been stashed away by George Washington, Thomas Jefferson and Benjamin Franklin.",2018.0
Life,1999,6.8,"Comedy, Crime, Drama",81011508,TV Show,Life,South Korea,2018-09-12,2018,TV-MA,1 Season,"International TV Shows, Korean TV Shows, TV Dramas","At Korea's top university medical center, ideals and interests collide between a patient-centered ER doctor and the hospital's newly-appointed CEO.",2018.0
Jersey Boys,2014,6.8,"Biography, Drama, Music",70299748,Movie,Jersey Boys,United States,2019-01-01,2014,R,134 min,"Dramas, Music & Musicals","Adapted from the hit Broadway musical, this nostalgic look at the Four Seasons and their bumpy offstage lives stretches across four decades.",2019.0
Easy,2017,6.8,Comedy,80095699,TV Show,Easy,United States,2019-05-10,2019,TV-MA,3 Seasons,"TV Comedies, TV Dramas","This eclectic, star-studded anthology follows diverse Chicagoans fumbling through the modern maze of love, sex, technology and culture.",2019.0
Bolt,2008,6.8,"Animation, Adventure, Comedy",70099615,Movie,Bolt,United States,2018-07-22,2008,PG,99 min,"Children & Family Movies, Comedies","This tale follows German shepherd Bolt, a canine actor who makes a cross-country trek when he's mistakenly shipped from Hollywood to New York City.",2018.0
The Lake House,2006,6.8,"Drama, Fantasy, Romance",70043303,Movie,The Lake House,United States,2019-09-01,2006,PG,98 min,"Dramas, Romantic Movies, Sci-Fi & Fantasy","A lonely doctor begins writing letters to the frustrated architect who lives in her former home, only to discover that they're living two years apart.",2019.0
Kodachrome,2017,6.8,Drama,80216834,Movie,Kodachrome,"Canada, United States",2018-04-20,2018,TV-MA,105 min,"Comedies, Dramas","A record company exec joins his estranged dad, a famous photographer who's dying, on a road trip to the last lab still developing Kodachrome film.",2018.0
Bhouri,2016,6.8,Drama,80203781,Movie,Bhouri,India,2017-12-01,2017,TV-14,123 min,"Dramas, Independent Movies, International Movies",A 23-year-old girl who's married to a man more than twice her age is forced to contend with the predatory nature of a male-dominated society.,2017.0
U Turn,1997,6.8,"Crime, Drama, Thriller",80127886,Movie,U Turn,India,2019-11-07,2016,TV-14,121 min,"International Movies, Thrillers",A reporter must hunt for the truth behind a strange murder after she crosses paths with a young cop and becomes the investigation's prime suspect.,2019.0
Raees,2017,6.8,"Action, Crime, Drama",80164778,Movie,Raees,India,2017-05-26,2017,NR,143 min,"Action & Adventure, Dramas, International Movies","After street smart kid Raees rises to become Gujarat's bootlegging king in the 1980s, he tries to balance his life of crime with helping his people.",2017.0
Timeline,2014,6.8,Romance,80184208,TV Show,Timeline,United States,2018-02-23,2014,TV-14,1 Season,"Crime TV Shows, Docuseries, International TV Shows","Firsthand accounts, re-enactments and computer-generated graphics retell in detail Thailand's biggest news stories from the past.",2018.0
Breath,2017,6.8,"Adventure, Drama, Romance",80244190,Movie,Breath,Australia,2018-12-05,2018,TV-MA,116 min,"Dramas, Sports Movies","In mid-1970s Australia, two small-town teenage boys befriend an enigmatic middle-aged surfer, who urges them to see the thrill in facing their fears.",2018.0
Shikari,2016,6.8,"Action, Crime, Drama",80156938,Movie,Shikari,"India, Soviet Union",2017-12-08,1991,TV-14,163 min,"Dramas, International Movies, Music & Musicals","When Shankar, who performs on the road with partner Chanchal and elephant Appu, falls for a Russian circus performer, jealousies and conflicts arise.",2017.0
Zero,2009,6.8,"Action, Drama",81005364,Movie,Zero,India,2019-05-21,2018,TV-14,159 min,"Comedies, Dramas, International Movies","Through his relationships with two wildly different women, a vertically challenged bachelor with a larger-than-life persona must discover his purpose.",2019.0
The House Next Door,2017,6.8,Horror,80233024,Movie,The House Next Door,India,2018-01-09,2017,TV-14,135 min,"Horror Movies, International Movies, Thrillers","In this Hindi version of ""Aval,"" a young couple's relationship is shaken to its core when a mysterious and troubled family moves into the neighborhood.",2018.0
21,2008,6.8,"Crime, Drama, History",70084788,Movie,21,United States,2020-01-01,2008,PG-13,123 min,Dramas,A brilliant group of students become card-counting experts with the intent of swindling millions out of Las Vegas casinos by playing blackjack.,2020.0
A Series of Unfortunate Events,2004,6.8,"Adventure, Comedy, Family",80050008,TV Show,A Series of Unfortunate Events,United States,2019-01-01,2019,TV-PG,3 Seasons,"Kids' TV, TV Action & Adventure, TV Comedies","The extraordinary Baudelaire orphans face trials, tribulations and the evil Count Olaf in their fateful quest to unlock long-held family secrets.",2019.0
Arjun: The Warrior Prince,2012,6.8,"Animation, Action, Adventure",70139073,Movie,Arjun: The Warrior Prince,India,2018-11-01,2011,TV-14,91 min,"Action & Adventure, Dramas, International Movies",This animated retelling of the classic Indian tale of Prince Arjun – part of the Sanskrit epic Mahabharata – begins during the prince's youth.,2018.0
War,2019,6.8,"Action, Thriller",70061480,Movie,War,"United States, Canada",2019-04-01,2007,R,103 min,Action & Adventure,"When his partner is killed and all clues point to a notorious assassin, FBI agent Jack Crawford sets out for revenge in this taut action-thriller.",2019.0
Goon,2011,6.8,"Comedy, Drama, Sport",70209163,Movie,Goon,"United States, Canada",2017-08-15,2011,R,92 min,"Comedies, Sports Movies","When he's seen dispatching a rude opposing hockey player in the stands, Doug Glatt is hired by a rival team ... for his fighting skills.",2017.0
"Bon Cop, Bad Cop",2006,6.8,"Action, Comedy, Crime",70095265,Movie,"Bon Cop, Bad Cop",Canada,2017-03-15,2006,R,117 min,"Action & Adventure, Comedies, International Movies",An English-speaking officer from Toronto and a French-speaking cop from Montreal are forced to work together to solve a crime.,2017.0
It Takes a Man and a Woman,2013,6.8,"Comedy, Drama, Romance",81010866,Movie,It Takes a Man and a Woman,Philippines,2019-02-27,2013,TV-PG,127 min,"Comedies, International Movies, Romantic Movies","Laida and Miggy used to be in love, but now they're forced to work together in a professional capacity – and neither is completely over their past.",2019.0
The Bleeding Edge,2016,6.8,"Crime, Thriller",80170862,Movie,The Bleeding Edge,"Australia, United States",2018-07-27,2018,TV-14,101 min,Documentaries,This eye-opening look at the fast-growing medical device industry reveals how the rush to innovate can lead to devastating consequences for patients.,2018.0
Mere Pyare Prime Minister,2018,6.8,Drama,80237006,Movie,Mere Pyare Prime Minister,India,2019-05-31,2019,TV-MA,103 min,"Dramas, International Movies","When his mother suffers a traumatic incident, a boy from the Mumbai slums treks to Delhi to deliver his written plea for justice to the Prime Minister.",2019.0
Imperial Dreams,2014,6.8,Drama,70301279,Movie,Imperial Dreams,United States,2017-02-03,2014,TV-MA,86 min,Dramas,"A young father returns home from jail eager to care for his son and become a writer, but crime, poverty and a flawed system threaten his plans.",2017.0
Rocky Handsome,2016,6.8,"Action, Thriller",80103428,Movie,Rocky Handsome,India,2017-02-17,2016,NR,119 min,"Action & Adventure, International Movies",A reclusive pawn shop owner sets his sights on revenge when vicious gangsters kidnap his drug-addicted neighbor's young daughter.,2017.0
Now and Then,1995,6.8,"Comedy, Drama, Romance",22469949,Movie,Now and Then,United States,2019-08-02,1995,PG-13,102 min,Dramas,"Waxing nostalgic about the bittersweet passage from childhood to puberty, four childhood girlfriends recall the magical summer of 1970.",2019.0
Manoranjan,1974,6.8,"Comedy, Musical, Romance",80158545,Movie,Manoranjan,India,2017-09-01,1974,TV-14,162 min,"Comedies, International Movies, Music & Musicals","After getting fired, a police officer connects with a prostitute he met on the job in a red-light district and sets out to keep her off the streets.",2017.0
Blood Money,1933,6.8,"Drama, Film-Noir, Romance",80175623,Movie,Blood Money,India,2017-03-27,2012,TV-14,110 min,"Dramas, International Movies, Romantic Movies","Ambitious Kunal takes a job in the diamond business, but his life is thrown into turmoil when he's drawn into the seedy underworld of his new career.",2017.0
Logan's Run,1976,6.8,"Action, Sci-Fi",709163,Movie,Logan's Run,United States,2019-11-01,1976,PG,118 min,"Action & Adventure, Classic Movies, Cult Movies","In the 23rd century, inhabitants of a domed city exist in a world filled with life's pleasures – but no one is allowed to live past the age of 30.",2019.0
Blood Money,1933,6.8,"Drama, Film-Noir, Romance",80209153,Movie,Blood Money,United States,2018-02-17,2017,R,85 min,Action & Adventure,Three friends on a wilderness trip find bags full of cash and must evade the criminal who hid the money in the first place.,2018.0
For Here or to Go?,2015,6.8,"Comedy, Drama",80176707,Movie,For Here or to Go?,"United States, India",2018-08-15,2015,TV-MA,105 min,"Comedies, Dramas, Independent Movies",A software engineer must decide if he'd rather navigate America's frustrating visa renewal process or simply return to his home country of India.,2018.0
Nila,2016,6.8,"Drama, Romance",80165917,Movie,Nila,India,2017-03-01,2016,NR,94 min,"Dramas, International Movies, Romantic Movies","When a cabbie chances upon his childhood sweetheart, he tries to rekindle old feelings but finds that mature love is a more complicated matter.",2017.0
Dil Dhadakne Do,2015,6.8,"Comedy, Drama, Romance",80057585,Movie,Dil Dhadakne Do,India,2019-12-15,2015,TV-14,174 min,"Comedies, Dramas, International Movies","While hosting a shipboard holiday for relatives and friends, a wealthy but dysfunctional family must face the ugly truths under their flawless facade.",2019.0
Lommbock,2017,6.8,Comedy,80191219,Movie,Lommbock,Germany,2018-11-09,2017,TV-MA,106 min,"Comedies, International Movies","After finding love in drug-free Dubai, Stefan returns to Germany to grab documents for his wedding. But old buddy Kai's bad habits complicate things.",2018.0
Mary Poppins Returns,2018,6.8,"Comedy, Family, Fantasy",80221446,Movie,Mary Poppins Returns,"United States, United Kingdom",2019-07-09,2018,PG,131 min,"Children & Family Movies, Music & Musicals","In 1930s London, Michael Banks and his three children get some help turning their topsy-turvy world around when his magical childhood nanny reappears.",2019.0
Drive,1997,6.8,"Action, Adventure, Sci-Fi",81189912,Movie,Drive,India,2019-11-01,2019,TV-14,119 min,"Action & Adventure, International Movies","A notorious thief allies with a street racer for a grand heist involving an elaborate game of deceit with authorities, who have their own dirty secrets.",2019.0
"Plaire, aimer et courir vite",2018,6.8,"Drama, Romance",81011936,Movie,"Plaire, aimer et courir vite",France,2019-07-13,2018,TV-MA,133 min,"Dramas, Independent Movies, International Movies","When a Paris-based writer with AIDS meets a college student exploring his sexuality, romance blossoms in his waning days.",2019.0
Drive,1997,6.8,"Action, Adventure, Sci-Fi",70189289,Movie,Drive,United States,2019-11-16,2011,R,100 min,"Action & Adventure, Dramas, Independent Movies",A Hollywood stuntman and getaway driver is lured from his isolated life by a lovely neighbor – until her violent husband is released from prison.,2019.0
The Island,2005,6.8,"Action, Sci-Fi, Thriller",81172901,Movie,The Island,Nigeria,2019-11-29,2018,TV-14,93 min,"Dramas, International Movies, Thrillers","When a colonel uncovers controversial intel about the government, he makes a shocking discovery and must decide whether to reveal it or risk his life.",2019.0
Blind Date,1996,6.8,Drama,80123744,Movie,Blind Date,France,2016-10-15,2015,TV-14,91 min,"Comedies, International Movies, Romantic Movies","A passionate pianist and a soulful puzzle maker who treasures silence aren't the best neighbors, but things get interesting when they start to date.",2016.0
Mary Kom,2014,6.8,"Action, Biography, Drama",80015785,Movie,Mary Kom,India,2017-05-01,2014,TV-14,120 min,"Dramas, International Movies, Sports Movies",The daughter of a poor rice farmer overcomes the objections of her father and the demands of a male-dominated society to pursue a career in boxing.,2017.0
Requiem,1982,6.8,Drama,80184068,TV Show,Requiem,United Kingdom,2018-03-23,2018,TV-MA,1 Season,"British TV Shows, International TV Shows, TV Dramas","In the wake of a sudden tragedy, a London cellist unearths secrets that link her mother to the disappearance of a young girl in a small Welsh town.",2018.0
Rocky III,1982,6.8,"Drama, Sport",60010836,Movie,Rocky III,United States,2019-08-01,1982,PG,100 min,"Dramas, Sports Movies","After taking a pounding from a powerful young fighter, humbled world champ Rocky Balboa turns to ex-rival Apollo Creed for help in regaining his form.",2019.0
A Family Affair,1937,6.8,Comedy,80089199,Movie,A Family Affair,"Netherlands, Denmark, South Africa",2016-10-16,2015,TV-PG,111 min,"Documentaries, International Movies",The filmmaker hunts for the missing puzzle pieces of his family history during a visit with a complex and controversial figure: his grandmother.,2016.0
7 años,2016,6.8,Drama,80095197,Movie,7 años,Spain,2016-10-27,2016,TV-MA,77 min,"Dramas, International Movies",Loyalties are tested and cruelties revealed when four business partners spend a tense evening debating who will pay for the crime they committed.,2016.0
A Futile and Stupid Gesture,2018,6.8,"Biography, Comedy",80107084,Movie,A Futile and Stupid Gesture,United States,2018-01-26,2018,TV-MA,102 min,Comedies,"In a brief life full of triumph and failure, ""National Lampoon"" co-founder Doug Kenney built a comedy empire, molding pop culture in the 1970s.",2018.0
To the Bone,2017,6.8,Drama,80171659,Movie,To the Bone,United States,2017-07-14,2017,TV-MA,108 min,"Dramas, Independent Movies","Ellen, a 20-year-old with anorexia nervosa, goes on a harrowing, sometimes funny journey of self-discovery at a group home run by an unusual doctor.",2017.0
Pukar,2000,6.8,"Action, Drama, Romance",60037397,Movie,Pukar,India,2018-03-01,2000,TV-14,165 min,"Action & Adventure, Dramas, International Movies",A notorious terrorist manipulates an Indian army major's jilted lover into helping him obtain a classified military code.,2018.0
